rating,review_title,review_text,reviewer_name,verified_purchase,review_date,helpful_upvotes,helpful_total,review_date_raw,product,sentiment,clean_text,word_count
5.0,Worth every penny,Design The iPhone 15 has a satin-finished design and a durable glass panel on the front.Dynamic Island The Dynamic Island helps with multitasking.IP68 ingress protection The iPhone 15 can withstand being submerged in up to 6 meters of fresh water for 30 minutes.Stereo speakers The iPhone 15's stereo speakers are loud and have good sound quality. The battery life is lower than expected draining very fast and as usual heating issues there.,jagabandhu jena,True,2024-10-01,3.0,0.0,"Oct, 2024",iPhone 15,positive,design iphone satin finished design durable glass panel front dynamic island dynamic island help multitasking ingres protection iphone withstand submerged meter fresh water minute stereo speaker iphone stereo speaker loud good sound quality battery life lower expected draining fast usual heating issue,42
5.0,Simply awesome,Everything is awesome! Great phone..,Adhitya Ramakrishnan,True,2024-10-01,3.0,0.0,"Oct, 2024",iPhone 15,positive,everything awesome great phone,4
5.0,Wonderful,Nice phone,Satyam Singh,True,2024-09-01,3.0,0.0,"Sep, 2024",iPhone 15,positive,nice phone,2
5.0,Simply awesome,"This is the first time I've purchased iphone and it's great.Performance, speed and the feature is good and new update of the IOS having great feature and customizations in the UI.",Atul kumar Soni,True,2024-08-01,3.0,0.0,"Aug, 2024",iPhone 15,positive,first time purchased iphone great performance speed feature good new update io great feature customizations,15
5.0,Simply awesome,Awesomeness Cellphone. This is my first IOS and the experience is fantastic I am loving it. The videography is to next level. Very Happy.,Akash  Banik,True,2024-07-01,3.0,0.0,"Jul, 2024",iPhone 15,positive,awesomeness cellphone first io experience fantastic loving videography next level happy,11
5.0,Must buy!,"Very nice iPhone 15, very good quality, very nice display. Very nice camera, thanks.",Santhosh Bachu,True,2024-06-01,3.0,0.0,"Jun, 2024",iPhone 15,positive,nice iphone good quality nice display nice camera thanks,9
5.0,Terrific,Nice product...camera is awesome....also light weight,pankaj singh,True,2024-06-01,3.0,0.0,"Jun, 2024",iPhone 15,positive,nice product camera awesome also light weight,7
5.0,Wonderful,Awesome experience in my opinion. I am first time iPhone user. And can say:-Camera: 10/10Performance: 10/10Display: 10/10Battery: 8/10,Gaurav Kumar,True,2024-05-01,3.0,0.0,"May, 2024",iPhone 15,positive,awesome experience opinion first time iphone user say camera performance display battery,12
5.0,Terrific purchase,"Awesome phone, thanks to Flipkart for quick delivery. This is my 1st iOS experience so very excited .",Bhaskar Jyoti  Saikia,True,2024-05-01,2.0,0.0,"May, 2024",iPhone 15,positive,awesome phone thanks flipkart quick delivery io experience excited,9
5.0,Excellent,Everything is fine but sometimes it unnecessarily heats up.,R K,True,2024-05-01,2.0,0.0,"May, 2024",iPhone 15,positive,everything fine sometimes unnecessarily heat,5
5.0,Awesome,"Upgraded from iPhone XS and it is really great!Display is very nice except the 60hzVolume is loudCameras are the best in the segmentNew frosted back glass is actually very good, feels premium to hold and does not get smudged easilyOverall a very nice package.",Soumya Ranjan Pradhan,True,2024-05-01,3.0,0.0,"May, 2024",iPhone 15,positive,upgraded iphone really great display nice except hzvolume loudcameras best segmentnew frosted back glass actually good feel premium hold get smudged easilyoverall nice package,24
5.0,Brilliant,NICE,Babul Ali,True,2024-04-01,3.0,0.0,"Apr, 2024",iPhone 15,positive,nice,1
5.0,Terrific purchase,Nice product but battery 🔋 quality Bad,ANKIT ANAND,True,2024-04-01,2.0,0.0,"Apr, 2024",iPhone 15,positive,nice product battery quality bad,5
5.0,Fabulous!,Beast in that price range ⚜️🔥,Flipkart Customer,True,2024-03-01,3.0,0.0,"Mar, 2024",iPhone 15,positive,beast price range,3
5.0,Awesome,-Wonderful performance-Camera quality is superb-battery backup not that good-sound quality is awesome,Flipkart Customer,True,2024-03-01,2.0,0.0,"Mar, 2024",iPhone 15,positive,wonderful performance camera quality superb battery backup good sound quality awesome,11
5.0,Excellent,Best product...,Ritu Raj,True,2024-02-01,3.0,0.0,"Feb, 2024",iPhone 15,positive,best product,2
5.0,Best in the market!,Switched from Redmi 12 5G to Iphone 15 . It feels like I have never used Phone. Totally Worth It and the Feeling of using Iphone is Super Awesome.,Rupesh jha,True,2024-02-01,3.0,0.0,"Feb, 2024",iPhone 15,positive,switched redmi iphone feel like never used phone totally worth feeling using iphone super awesome,15
5.0,Mind-blowing purchase,Nice prodouct thank you flipkart,PRAKASH MANDAL,True,2024-01-01,3.0,0.0,"Jan, 2024",iPhone 15,positive,nice prodouct thank flipkart,4
5.0,Highly recommended,I love it,Manish  sinha,True,2024-01-01,3.0,0.0,"Jan, 2024",iPhone 15,positive,love,1
5.0,Terrific purchase,"Switching Android to ios awesome experience,I just love it . And thanks Flipkart for open box delivery option.",SHUVAM DAS,True,2023-10-01,3.0,0.0,"Oct, 2023",iPhone 15,positive,switching android io awesome experience love thanks flipkart open box delivery option,12
5.0,Excellent,Nice phone ✌🏻,Flipkart Customer,True,2024-02-01,5.0,1.0,10 months ago,iPhone 15,positive,nice phone,2
5.0,Brilliant,What to say about iphone😂If you have money then buy it.,Sourajyoti  Malakar,True,2024-09-01,5.0,1.0,"Sep, 2024",iPhone 15,positive,say iphone money buy,4
5.0,Excellent,Am a Android User First Time Switching To IOS Really Its Awesome (iphone 15) Camera 5/5Battery 4/5Design 5/5Display 5/5Speaker 5/5,Vicky Krishna,True,2024-05-01,4.0,1.0,"May, 2024",iPhone 15,positive,android user first time switching io really awesome iphone camera battery design display speaker,14
5.0,Worth every penny,All are good 😊,MOBARAK SK,True,2024-03-01,5.0,1.0,"Mar, 2024",iPhone 15,positive,good,1
5.0,Just wow!,Excellent purchase battery life is good for medium usage but can get you through the whole day on single charge. Am just loving this phone,Himalaya  Panwar,True,2024-03-01,5.0,1.0,"Mar, 2024",iPhone 15,positive,excellent purchase battery life good medium usage get whole day single charge loving phone,14
5.0,Classy product,"Initially I missed 120 Hz screen refresh rate after switching from Mi 11x pro to iphone15. It been a month using iPhone 15, accordingly to my experience, unless you want to purchase more apple products like Mac book, apple watch etc. it is not smart decision to buy iphone. But I surely appreciated it's small form factor and less weight. Battery backup is also good.",Flipkart Customer,True,2024-02-01,5.0,1.0,"Feb, 2024",iPhone 15,positive,initially missed screen refresh rate switching pro iphone month using iphone accordingly experience unless want purchase apple product like mac book apple watch etc smart decision buy iphone surely appreciated small form factor less weight battery backup also good,39
5.0,Excellent,Awesome product and received an original product,Prashanth  Reddy,True,2024-01-01,5.0,1.0,"Jan, 2024",iPhone 15,positive,awesome product received original product,5
5.0,Super!,Awestruck by its performance 👌,KaryD,True,2023-09-01,4.0,1.0,"Sep, 2023",iPhone 15,positive,awestruck performance,2
5.0,Just wow!,Far better than 15pro no finger print even with moisturize hands,Biswadeep Roy,True,2023-09-01,21.0,13.0,"Sep, 2023",iPhone 15,positive,far better pro finger print even moisturize hand,8
5.0,Just wow!,The iPhone 15 features a 48-megapixel main camera sensorIt is powered by the A16 Bionic SoCThe iPhone 15 now comes with Dynamic I,Ashwani Mishra,True,2024-06-01,8.0,3.0,"Jun, 2024",iPhone 15,positive,iphone feature megapixel main camera sensorit powered bionic socthe iphone come dynamic,12
5.0,Great product,The best one from apple💙,Dev Sarda,True,2023-10-01,8.0,3.0,"Oct, 2023",iPhone 15,positive,best one apple,3
5.0,Perfect product!,Amazing 😍😍😍😍Just go and buy it blindly if you have enough of money,Venkat Ramana,True,2023-09-01,7.0,3.0,"Sep, 2023",iPhone 15,positive,amazing buy blindly enough money,5
4.0,Delightful,"I bought this in big billion days in Flipkart, overall the pho",Ashbin paul Paul,True,2024-02-01,3.0,0.0,3 months ago,iPhone 15,positive,bought big billion day flipkart overall pho,7
4.0,Really Nice,Damn good,Sunil Choudhary,True,2024-02-01,3.0,0.0,5 months ago,iPhone 15,positive,damn good,2
4.0,Very Good,☺️Awesome must buy it I m really happy with iPhone 15 ❤️😊🥹😍,Megha bodhan,True,2024-07-01,3.0,0.0,"Jul, 2024",iPhone 15,positive,awesome must buy really happy iphone,6
4.0,Nice product,"Phone is good but if u already have an iPhone 12,13,14 then it's not worth upgrading, same design and similar performance except dynamic Island which I guarantee you will ever notice or use",Manoj negi,True,2024-06-01,3.0,0.0,"Jun, 2024",iPhone 15,positive,phone good already iphone worth upgrading design similar performance except dynamic island guarantee ever notice use,16
4.0,Wonderful,I phone is phone nothing but it's a brand that makes the cost. Better should be more improved. And it gives heat.,Motam Jamatia,True,2024-06-01,3.0,0.0,"Jun, 2024",iPhone 15,positive,phone phone nothing brand make cost better improved give heat,10
4.0,Good quality product,Much faster and best camera only issue of battery one day easily use after full charge. Design Awesome 🤘🏻✌️.best color in images and 4K with 60 fps is awesome.,Aalok Singh,True,2024-05-01,3.0,0.0,"May, 2024",iPhone 15,positive,much faster best camera issue battery one day easily use full charge design awesome best color image fps awesome,19
4.0,Good quality product,Apple as usual. Eco system is great. Rest all are average for the price but I paid for the ecosystem,Shadab Lampsy,True,2024-05-01,3.0,0.0,"May, 2024",iPhone 15,positive,apple usual eco system great rest average price paid ecosystem,10
4.0,Unsatisfactory,Product is good. But worst delivery experience,Praveen sarwa,True,2024-03-01,3.0,0.0,"Mar, 2024",iPhone 15,positive,product good worst delivery experience,5
4.0,Good quality product,Overall performance is best.Good aesthetic and nice color. Only thing worries me that it gets really hot with increase of brightness and during 15 min video call..,Deepti Rankhambe,True,2024-02-01,2.0,0.0,"Feb, 2024",iPhone 15,positive,overall performance best good aesthetic nice color thing worry get really hot increase brightness min video call,17
4.0,Worth the money,Phone is great.,Sandeep Mehta,True,2024-01-01,2.0,0.0,"Jan, 2024",iPhone 15,positive,phone great,2
4.0,Delightful,Love iphone 15,Kiran  Biswas,True,2024-02-01,5.0,1.0,6 months ago,iPhone 15,positive,love iphone,2
4.0,Wonderful,"Well, there is a little bit of hitting issue there, not at charging but in general operations. From design perspective, dynamic island is horribly thick for a 6.1 screen. It could have been smarter if the look was a little bit slim. What stops apple to increase the battery capacity now a days is beyond explanation. The Chinese manufacturers has definitely done a phenomenal job in terms of both the battery and charging. There's no trade Off there, it's a success for them. In software, the comp...",Pinaki Ray,True,2024-04-01,5.0,1.0,"Apr, 2024",iPhone 15,positive,well little bit hitting issue charging general operation design perspective dynamic island horribly thick screen could smarter look little bit slim stop apple increase battery capacity day beyond explanation chinese manufacturer definitely done phenomenal job term battery charging trade success software comp,42
4.0,Nice product,"Phone is good. Good battery backup , upgraded camera. But I feel refresh rate should be 90hz atleast.",Nalinakshya Sahoo,True,2024-01-01,5.0,1.0,"Jan, 2024",iPhone 15,positive,phone good good battery backup upgraded camera feel refresh rate atleast,11
3.0,Just okay,"The only thing I like about this phone is the camera quality and that is the reason I bought this phone.I already have an Android phone which is less than 50% of its price and still is better in every aspect except the camera.Well! Definitely, iphone 15 has a flagship level chipset but I am not a gamer and a normal user and I find mid rangers and flagship all perform at similar level in daily tasks.While iphone 15 only has 60hz screen which feels choppy, all other phones have 120-144hz scr...",Amit Tekriwal,True,2024-01-01,21.0,6.0,"Jan, 2024",iPhone 15,neutral,thing like phone camera quality reason bought phone already android phone less price still better every aspect except camera well definitely iphone flagship level chipset gamer normal user find mid ranger flagship perform similar level daily task iphone screen feel choppy phone scr,43
3.0,Nice,Too much heat when camera used,Baljinder Singh,True,2024-09-01,5.0,0.0,"Sep, 2024",iPhone 15,neutral,much heat camera used,4
5.0,Just wow!,"The best part of camera is cinematic video which is fabulous. Rest of the things are good, but cinematic mode is on next level, higher rate is missing which may hurt phone noise cancellation is on. Also next level. Some small small features which make sweet point to use and make it different from android efforts of making iOS and developing some sweet sweet things are appreciable and if you have MacBook or iPad, ecosystem work, fantastically the best things for this iPhone is much much better...",ANKIT kumar,True,2024-05-01,6.0,2.0,"May, 2024",iPhone 15,positive,best part camera cinematic video fabulous rest thing good cinematic mode next level higher rate missing may hurt phone noise cancellation also next level small small feature make sweet point use make different android effort making io developing sweet sweet thing appreciable macbook ipad ecosystem work fantastically best thing iphone much much better,53
5.0,Mind-blowing purchase,My mom gift,Naseer Ahmed,True,2024-02-01,6.0,2.0,"Feb, 2024",iPhone 15,positive,mom gift,2
5.0,Classy product,awsm phone. best performance,Suman Chakraborty,True,2024-02-01,6.0,2.0,"Feb, 2024",iPhone 15,positive,awsm phone best performance,4
5.0,Worth every penny,Very nice phone im happy very good 👍,Sabir Khan,True,2024-01-01,6.0,2.0,"Jan, 2024",iPhone 15,positive,nice phone happy good,4
5.0,Fabulous!,Very good product,anujyadav anuj,True,2023-09-01,6.0,2.0,"Sep, 2023",iPhone 15,positive,good product,2
4.0,Value-for-money,"Phone is good built lightweight,handy, camera good quality, display great phone is nice if love it's OS and can spend that much",Vishnu Singh,True,2024-03-01,11.0,6.0,"Mar, 2024",iPhone 15,positive,phone good built lightweight handy camera good quality display great phone nice love spend much,15
5.0,Great product,Overall Beast Performance 🔥10/10 Just Go For It 😎👍,Krupansh Patel,True,2023-10-01,7.0,3.0,"Oct, 2023",iPhone 15,positive,overall beast performance,3
5.0,Must buy!,Very good,Naresh Soni,True,2023-09-01,7.0,2.0,"Sep, 2023",iPhone 15,positive,good,1
5.0,Terrific purchase,Execpt battery everything work awesome,Flipkart Customer,True,2023-10-01,8.0,3.0,"Oct, 2023",iPhone 15,positive,execpt battery everything work awesome,5
5.0,Must buy!,What a phone super performance with light weight. Please find my details review as follows. 1. Camera - camera is super with very gud quality photo even at night as well. 2. Battery - battery backup is fine and will last for one day long. 3. Performance - iphone 15 performance is super. No lagging and no heating issue. Cons-1. Battery could be better at this price range. 2. Face recognition is not good as not always open with face ID,Sudipto Sarkar,True,2024-02-01,9.0,5.0,"Feb, 2024",iPhone 15,positive,phone super performance light weight please find detail review follows camera camera super gud quality photo even night well battery battery backup fine last one day long performance iphone performance super lagging heating issue con battery could better price range face recognition good always open face,46
5.0,Perfect product!,First time experiencing I phone. It feels premium and quality is awesome love it ❤️❤️❤️,ABDUR RAHMAN,True,2023-09-01,43.0,45.0,"Sep, 2023",iPhone 15,positive,first time experiencing phone feel premium quality awesome love,9
5.0,Classy product,Everything is good. Battery backup is hardly 6hrs will come while continuously usage. Camera is fantastic. In this iphone 60 hz refreshing rate is equals to 120hz refresh rate in android. Very light weight.,Pentakota Pavan,True,2023-11-01,25.0,23.0,"Nov, 2023",iPhone 15,positive,everything good battery backup hardly hr come continuously usage camera fantastic iphone refreshing rate equal refresh rate android light weight,20
5.0,Great product,Nice product. The look of the phone is awesome 👌. Great to have the iphone black color.,Tekchand Biswal,True,2023-10-01,31.0,31.0,"Oct, 2023",iPhone 15,positive,nice product look phone awesome great iphone black color,9
3.0,Does the job,Camera very hard but phone heating 😒😒,Flipkart Customer,True,2024-04-01,7.0,1.0,"Apr, 2024",iPhone 15,neutral,camera hard phone heating,4
4.0,Delightful,"I have both galaxy s23 and iphone, galaxy is taking 9/10 good photos compared to iphone 7/10 photos. Iphone only shine on video.For better photo buy galaxy s23Better video go for iphone.",Santu Rana,True,2024-06-01,8.0,4.0,"Jun, 2024",iPhone 15,positive,galaxy iphone galaxy taking good photo compared iphone photo iphone shine video better photo buy galaxy better video iphone,19
4.0,Pretty good,"I am an iphone user since long. I have bought this YELLOW colour. But really feel that apple should rethink and rename this colour as GOLDEN YELLOW, its edges are slightly on the Golden side as you can see in the pics. Additional feature as compare to iphone 13, this has Dynamic Island and camera is superb 👌🏻 I am using it for 5 hrs daily, not facing any heating issue as such.",Dipin Kapoor,True,2024-05-01,8.0,4.0,"May, 2024",iPhone 15,positive,iphone user since long bought yellow colour really feel apple rethink rename colour golden yellow edge slightly golden side see pic additional feature compare iphone dynamic island camera superb using hr daily facing heating issue,35
5.0,Mind-blowing purchase,"I have moved from android to ios, iphone 15 is really a good device, fulfills all the basic things that needed at daily lifeJust a note for the battery consumption, it drains a bit fast",Kajal Yadav,True,2024-10-01,4.0,1.0,"Oct, 2024",iPhone 15,positive,moved android io iphone really good device fulfills basic thing needed daily lifejust note battery consumption drain bit fast,19
5.0,Brilliant,Firstly I worried that Flipkart send duplicate or refurbished iPhone but I am wrong great shopping experience genuine product at reasonable price max discount rather than other online or offline platforms great deal with Flipkart I am impressed and obviously great product from Apple,SAURABH KUMAR,True,2024-07-01,4.0,1.0,"Jul, 2024",iPhone 15,positive,firstly worried flipkart send duplicate refurbished iphone wrong great shopping experience genuine product reasonable price max discount rather online offline platform great deal flipkart impressed obviously great product apple,29
5.0,Excellent,Camera is best quality,vikash kumar,True,2024-06-01,4.0,1.0,"Jun, 2024",iPhone 15,positive,camera best quality,3
5.0,Excellent,"Mind-blowing I love it Everything is greatttVery good battery backup, best camera, very good design.Update after using for 1 week: I legit have to charge my phone for 2times in a day else everything is great",Flipkart Customer,True,2024-05-01,4.0,1.0,"May, 2024",iPhone 15,positive,mind blowing love everything greatttvery good battery backup best camera good design update using week legit charge phone time day else everything great,23
5.0,Wonderful,"I recently purchased the iPhone 15 from Flipkart, and I'm thrilled with my experience. The sleek design and vibrant display are stunning, and the performance is top-notch with its powerful A16 Bionic chip. The camera quality is exceptional, capturing detailed and vivid photos even in low light. Battery life has been impressive, easily lasting a full day with heavy use. Flipkart's delivery was prompt, and the packaging was secure. Overall, I'm extremely satisfied with my purchase and would hig...",Jishnu  Samanta,True,2024-05-01,4.0,1.0,"May, 2024",iPhone 15,positive,recently purchased iphone flipkart thrilled experience sleek design vibrant display stunning performance top notch powerful bionic chip camera quality exceptional capturing detailed vivid photo even low light battery life impressive easily lasting full day heavy use flipkart delivery prompt packaging secure overall extremely satisfied purchase would hig,47
5.0,Terrific purchase,"Upgraded from Iphone 11. worth buying it. here are some pros and cons.Pros:1) Smooth, constant software update, 2)6 GB RAM,1 day easily sustainable battery life3) extremely helpful if you are in apple ecosystem.4) 48MP camera is really great if we compare  with my I Phone 11's 12 MP .Best video quality.5) don't go for 15 plus or pro model even if you have enough money. but 128 GB base model within 65000 RS and use that extra money to buy MacBook AIR or airpod 3rd GEN.CONS:1) 60HZ disp...",Amiya Roy,True,2024-04-01,4.0,1.0,"Apr, 2024",iPhone 15,positive,upgraded iphone worth buying pro con pro smooth constant software update ram day easily sustainable battery life extremely helpful apple ecosystem camera really great compare phone best video quality plus pro model even enough money base model within use extra money buy macbook air airpod gen con disp,48
5.0,Worth every penny,All good in this n camera superb,Amish Kumar yadav,True,2024-04-01,4.0,1.0,"Apr, 2024",iPhone 15,positive,good camera superb,3
5.0,Simply awesome,Amazing Camera and battery,Vamshi Reddy,True,2024-02-01,4.0,1.0,"Feb, 2024",iPhone 15,positive,amazing camera battery,3
5.0,Best in the market!,Excellent product,Ashis Karamakar,True,2024-02-01,3.0,1.0,"Feb, 2024",iPhone 15,positive,excellent product,2
5.0,Worth every penny,The product is good.Prize is excessive due to Apple branding only. Battery backup is not up to expectations. Flagship Titanium is lacking in it which is available in pro models only. At this price the screen should have been 6.8 inches at least.,Atul Rasyal,True,2024-01-01,4.0,1.0,"Jan, 2024",iPhone 15,positive,product good prize excessive due apple branding battery backup expectation flagship titanium lacking available pro model price screen inch least,20
5.0,Perfect product!,I can say the 60hz doesn't feel 60hz it is very smooth and may be because of appleI was too worried about the 60 hz because I was switching from 120hz Android (realme GT master edition) to this one but after using iphone 15 I feel lags in my android 120hzBut I feel camera quality is avg but videography is next level Love the speakerQuality of display is just wowCharging is also quite good and battery backup is also awesomeI am getting 5-6 hr gameplay(free fire+bgmi) from 100% to 25% qui...,Abhisekh Kumar,True,2024-01-01,4.0,1.0,"Jan, 2024",iPhone 15,positive,say feel smooth may applei worried switching android realme master edition one using iphone feel lag android hzbut feel camera quality avg videography next level love speakerquality display wowcharging also quite good battery backup also awesomei getting gameplay free fire bgmi qui,42
5.0,Awesome,Click the pic is amazing.,SUMIT LOHIA,True,2024-01-01,4.0,1.0,"Jan, 2024",iPhone 15,positive,click pic amazing,3
5.0,Simply awesome,Awesome.Camera too goodDisplay too goodBattery GoodFeels too good,Rahul Banerjee,True,2023-11-01,4.0,1.0,"Nov, 2023",iPhone 15,positive,awesome camera gooddisplay goodbattery goodfeels good,6
5.0,Wonderful,Look and design very nice,Nitin Patil,True,2023-10-01,4.0,1.0,"Oct, 2023",iPhone 15,positive,look design nice,3
3.0,Nice,"Very BAD experience I'm extremely disappointed with my iOS experience after switching from Android. While the camera and display are outstanding, performance issues overshadowed these positives. Within two days, I encountered severe battery drain (only 4-5 hours) and overheating. Worse, the phone lags and becomes unbearably hot. These issues mar an otherwise great device.",Tarun Kumar,True,2024-10-01,9.0,2.0,"Oct, 2024",iPhone 15,neutral,bad experience extremely disappointed io experience switching android camera display outstanding performance issue overshadowed positive within two day encountered severe battery drain hour overheating worse phone lag becomes unbearably hot issue mar otherwise great device,35
3.0,Decent product,ok,Flipkart Customer,True,2023-10-01,9.0,2.0,"Oct, 2023",iPhone 15,neutral,,0
4.0,Worth the money,"Perfect one to upgrade Edit after 7 months : No diappointments , build quality good as this has undergone few hard falls . Underwater also good . Camera quality is awesome . Battery is always a issue but it is okay for a person uses 5-6 hours daily . Videos are also good in cinematic mode . Good update i bought it at 78k when launched . But Around 65 it is super deal to do at this time .",Mahipal Gariya,True,2023-10-01,3.0,1.0,"Oct, 2023",iPhone 15,positive,perfect one upgrade edit month diappointments build quality good undergone hard fall underwater also good camera quality awesome battery always issue okay person us hour daily video also good cinematic mode good update bought launched around super deal time,39
3.0,Fair,Almost  good but the battery is overheating i don't know why and it drained very quickly this is the one of the major issues in this phone otherwise all ok but not satisfied with the battery,Flipkart Customer,True,2024-09-01,4.0,0.0,"Sep, 2024",iPhone 15,neutral,almost good battery overheating know drained quickly one major issue phone otherwise satisfied battery,14
