rating,review_title,review_text,reviewer_name,verified_purchase,review_date,helpful_upvotes,helpful_total,review_date_raw,product,sentiment,clean_text,word_count
5.0,Super!,Awesome I switched from Android it's great feeling just go for it 🥰🥰🥰,Divyanshu Roy,True,2024-02-01,2.0,1.0,"Feb, 2024",iPhone 15,positive,awesome switched android great feeling,5
5.0,Simply awesome,Simply AWESOME 😍,Rajesh Kumar,True,2024-02-01,2.0,0.0,"Feb, 2024",iPhone 15,positive,simply awesome,2
5.0,Awesome,"Very good product,",Hariom,True,2024-02-01,1.0,1.0,"Feb, 2024",iPhone 15,positive,good product,2
5.0,Classy product,"Undoubtedly, best phone for the next few years to come !! Flipkart has given the best buyback price so far for me on whatever iPhones I have purchased.",Srinivas Kannan,True,2024-02-01,1.0,0.0,"Feb, 2024",iPhone 15,positive,undoubtedly best phone next year come flipkart given best buyback price far whatever iphones purchased,15
5.0,Classy product,"This iPhone 15 is simply amazing. Was dicey about ordering it online as I was concerned if it would be genuine. But I got the iPhone which was in perfect condition. Talking about the phone and features, the camera is great and the iOS user experience is brilliant, performance is amazing, although the battery drains out a bit fast but with proper settings that can be handled too. Overall it's a great phone if you have the budget and it's the best time to buy if you're considering switching fro...",Surya Duvvuri,True,2024-01-01,1.0,0.0,"Jan, 2024",iPhone 15,positive,iphone simply amazing dicey ordering online concerned would genuine got iphone perfect condition talking phone feature camera great io user experience brilliant performance amazing although battery drain bit fast proper setting handled overall great phone budget best time buy considering switching fro,42
5.0,Terrific,Awesome camera,Bharat Raj Rohidas,True,2024-01-01,2.0,0.0,"Jan, 2024",iPhone 15,positive,awesome camera,2
5.0,Super!,Superb phone ❤️ I am using last 5 year of iPhone,Karan Yaduvanshi,True,2024-01-01,1.0,1.0,"Jan, 2024",iPhone 15,positive,superb phone using last year iphone,6
5.0,Super!,"This is my first iPhone, software is a bit confusing but we will get used to it by the time and the product quality is extraordinary. If you have budget and wanting an iPhone you can go for it. This phone is very compact.",Rahul,True,2023-12-01,2.0,0.0,"Dec, 2023",iPhone 15,positive,first iphone software bit confusing get used time product quality extraordinary budget wanting iphone phone compact,16
5.0,Perfect product!,The colour blue is so good and the battery life is so long as compared to 14 the camera is much better than 14series best phone I experienced very good,Mohd Siddique,True,2023-11-01,2.0,1.0,"Nov, 2023",iPhone 15,positive,colour blue good battery life long compared camera much better series best phone experienced good,15
5.0,Fabulous!,Great phone but still missing 90hz refresh rate display!,Ashok kumar,True,2023-11-01,2.0,1.0,"Nov, 2023",iPhone 15,positive,great phone still missing refresh rate display,7
5.0,Great product,Just wowwww ❤️,Sovan Sarkar,True,2023-10-01,2.0,1.0,"Oct, 2023",iPhone 15,positive,wow,1
5.0,Excellent,Value for money,Rishabh  Singh,True,2024-02-01,1.0,0.0,1 month ago,iPhone 15,positive,value money,2
5.0,Wonderful,"Nyz phone , Good battery backup. Overall value for money🙌.",Flipkart Customer,True,2024-02-01,0.0,0.0,2 months ago,iPhone 15,positive,nyz phone good battery backup overall value money,8
5.0,Mind-blowing purchase,Love to use iphone. Excellent product,sufiyan kansara,True,2024-02-01,1.0,0.0,3 months ago,iPhone 15,positive,love use iphone excellent product,5
5.0,Terrific purchase,Thanks Apple ✨❤️,Harshit Prajapati,True,2024-02-01,1.0,0.0,3 months ago,iPhone 15,positive,thanks apple,2
5.0,Perfect product!,All quality are good,Isha Rajput,True,2024-02-01,1.0,0.0,3 months ago,iPhone 15,positive,quality good,2
1.0,Very poor,Bad,Danish  Khan,True,2024-10-01,0.0,0.0,14 days ago,Samsung S24,negative,bad,1
1.0,Horrible,"Image is only for show. When you buy this, it will have an Exynos processor instead of a Snapdragon. I tried to return it, but it was not possible. The phone is good, but it does not have the Snapdragon processor integrated.",Anshul Chauhan,True,2024-10-01,1.0,0.0,15 days ago,Samsung S24,negative,image show buy exynos processor instead snapdragon tried return possible phone good snapdragon processor integrated,15
1.0,Hated it!,Battery backup is so tinny it is running only 3-4 hrs it is so terrible 😫,Flipkart Customer,True,2024-10-01,3.0,1.0,18 days ago,Samsung S24,negative,battery backup tinny running hr terrible,6
1.0,Worst experience ever!,No this is not nice quality is low,Karmjeet Karmjeet,True,2024-10-01,0.0,0.0,19 days ago,Samsung S24,negative,nice quality low,3
1.0,Unsatisfactory,All good but not for good battery 🔋,Dev Mandal,True,2024-10-01,2.0,0.0,19 days ago,Samsung S24,negative,good good battery,3
1.0,Don't waste your money,Bettery back not working properly,Nihal Dubey,True,2024-10-01,0.0,0.0,20 days ago,Samsung S24,negative,bettery back working properly,4
1.0,Unsatisfactory,Baddest,Paresh Biswas,True,2024-10-01,1.0,0.0,21 days ago,Samsung S24,negative,baddest,1
1.0,Waste of money!,Camera when its night it have line when u shake i don't like,Flipkart Customer,True,2024-10-01,1.0,0.0,22 days ago,Samsung S24,negative,camera night line shake like,5
1.0,Absolute rubbish!,Overheating and battery problems,Mohammad  Kadim,True,2024-10-01,4.0,2.0,23 days ago,Samsung S24,negative,overheating battery problem,3
1.0,Utterly Disappointed,Camera quality is not as expected.,RANJEET  Bandal,True,2024-10-01,2.0,0.0,23 days ago,Samsung S24,negative,camera quality expected,3
1.0,Horrible,"Usb c charging port don't working properly, One side of type c port is dead. Battery is not pathetic. Don't recommend this pho",aman sharma,True,2024-10-01,2.0,1.0,24 days ago,Samsung S24,negative,usb charging port working properly one side type port dead battery pathetic recommend pho,14
1.0,Utterly Disappointed,Heating issues.,Mahesh N,True,2024-10-01,4.0,0.0,24 days ago,Samsung S24,negative,heating issue,2
1.0,Utterly Disappointed,Not worth this mobile this budget,Uppala Chandra Sekhar,True,2024-10-01,0.0,0.0,24 days ago,Samsung S24,negative,worth mobile budget,3
1.0,Don't waste your money,Facing heating since day 1,Swarup Birelliwar,True,2024-10-01,2.0,0.0,25 days ago,Samsung S24,negative,facing heating since day,4
1.0,Did not meet expectations,Battery is worst. It is draining too fast At night if battery is 30% morning the phone is switched off. Not happy with the battery at all And when given to service centre in warranty period which is till 5th nov i received the phone on 5th nov they said the phone is activated on 26th oct I had ordered from flipkart. So flipkart is also scamming with the clients. So need a solution to this flipkart. Don't buy this product and don't buy from flipkart,Dipsy Shah,True,2024-10-01,2.0,2.0,25 days ago,Samsung S24,negative,battery worst draining fast night battery morning phone switched happy battery given service centre warranty period till nov received phone nov said phone activated oct ordered flipkart flipkart also scamming client need solution flipkart buy product buy flipkart,38
1.0,Worst experience ever!,Heating issue,JAGDEEP SINGH,True,2024-10-01,2.0,0.0,25 days ago,Samsung S24,negative,heating issue,2
1.0,Did not meet expectations,Camera is not good... Samsung has to work on it... over all mobile is good,Adv R L Lakole,True,2024-10-01,0.0,0.0,26 days ago,Samsung S24,negative,camera good samsung work mobile good,6
1.0,Unsatisfactory,"Worst phone , too much heat",Satya Venkatesh,True,2024-10-01,1.0,0.0,26 days ago,Samsung S24,negative,worst phone much heat,4
1.0,Unsatisfactory,Not working within 20 days,Kishan thumbar,True,2024-10-01,0.0,1.0,27 days ago,Samsung S24,negative,working within day,3
1.0,Unsatisfactory,Camera quality is even way below average. There is some issues with it.,Mayur Sanghani,True,2024-10-01,0.0,0.0,27 days ago,Samsung S24,negative,camera quality even way average issue,6
1.0,Absolute rubbish!,My battery is draining super fast,Flipkart Customer,True,2024-10-01,0.0,2.0,28 days ago,Samsung S24,negative,battery draining super fast,4
1.0,Waste of money!,"One of the worst samsung, I ever used i am we read with this s24 the battery life sucks theThe charging sucks. Then, the camera sucksUi sucks operating system sucks the chip set, snap dragon also sucks. The phone is heating.I can't describe how this phone get me traumatised. When I hear the name SamsungThe phone Sometimes stack scrolling through Instagram and YouTube makes lack and buffer. I why this product is like this",Flipkart Customer,True,2024-10-01,2.0,11.0,28 days ago,Samsung S24,negative,one worst samsung ever used read battery life suck thethe charging suck camera sucksui suck operating system suck chip set snap dragon also suck phone heating describe phone get traumatised hear name samsungthe phone sometimes stack scrolling instagram youtube make lack buffer product like,44
1.0,Very poor,Very bad experience. Received copy cable in the box. It is very thin and rigid.,Himanshu Chaturvedi,True,2024-10-01,0.0,1.0,28 days ago,Samsung S24,negative,bad experience received copy cable box thin rigid,8
1.0,Don't waste your money,"A phone with the WORST PERFORMANCE in  LOW LIGHT PHOTOGRAPHY in all the 4 cameras in it,  in this price range. In low light, the cameras capture only NOISE not photo.",Abhishek Majumdar,True,2024-10-01,3.0,4.0,28 days ago,Samsung S24,negative,phone worst performance low light photography camera price range low light camera capture noise photo,15
1.0,Useless product,Heating issue is 10x than my 17k old phn,Ayesha Nk,True,2024-10-01,3.0,1.0,29 days ago,Samsung S24,negative,heating issue old phn,4
1.0,Terrible product,"Issues with this device 1. Battery drain 2. Heating while using normal apps,  using camera  , in gaming it becomes a frying pan , in sunlight it becomes like a lava ...",Vishal  Saijwani,True,2024-10-01,4.0,0.0,30 days ago,Samsung S24,negative,issue device battery drain heating using normal apps using camera gaming becomes frying pan sunlight becomes like lava,18
1.0,Not recommended at all,Bad quality,Flipkart Customer,True,2024-10-01,1.0,0.0,30 days ago,Samsung S24,negative,bad quality,2
1.0,Very poor,Very bad 😞😞😞,Flipkart Customer,True,2024-10-01,0.0,1.0,1 month ago,Samsung S24,negative,bad,1
1.0,Not recommended at all,Worst flipkart,HAZARATH  REDDY,True,2024-10-01,2.0,1.0,1 month ago,Samsung S24,negative,worst flipkart,2
1.0,Absolute rubbish!,The phone screen got black and not operating suddenly poor product quality don't buy this product....very poor,Flipkart Customer,True,2024-10-01,3.0,2.0,1 month ago,Samsung S24,negative,phone screen got black operating suddenly poor product quality buy product poor,12
1.0,Unsatisfactory,I didn't insert the sim card into the sim slot but it shows full network bar without any sim card inserted,Naresh Selvam,True,2024-10-01,3.0,16.0,1 month ago,Samsung S24,negative,insert sim card sim slot show full network bar without sim card inserted,13
1.0,Worst experience ever!,The heats up a lot.,Dipanjan Pal,True,2024-10-01,4.0,0.0,1 month ago,Samsung S24,negative,heat lot,2
1.0,Worst experience ever!,Earphone plug not working new mobileWhat should I do,Flipkart Customer,True,2024-10-01,2.0,5.0,1 month ago,Samsung S24,negative,earphone plug working new mobilewhat,5
1.0,Hated it!,Not worthful,Flipkart Customer,True,2024-10-01,0.0,0.0,1 month ago,Samsung S24,negative,worthful,1
1.0,Did not meet expectations,Its heating up like he'll.,Vishwaksena Maganti,True,2024-10-01,2.0,0.0,1 month ago,Samsung S24,negative,heating like,2
1.0,Useless product,Very small size of screen.No anybody buy it,Mahesh Bhanawat,True,2024-10-01,2.0,13.0,1 month ago,Samsung S24,negative,small size screen anybody buy,5
1.0,Terrible product,Never buy on Flipkart,Ramanuj  Kumar,True,2024-10-01,2.0,1.0,1 month ago,Samsung S24,negative,never buy flipkart,3
1.0,Did not meet expectations,Camera disappointed 😞 more compare to one,gpraveen kumar,True,2024-10-01,1.0,2.0,1 month ago,Samsung S24,negative,camera disappointed compare one,4
1.0,Waste of money!,After 3 weeks of usage ... phone is heating while using the camera.Finger print sensor not upto the mark...Pathetic  performane  even with wifi...other lower version phones working much betterOverall it is good buy for a flagship phoneI prefer don't buy,Kishore Kurmala,True,2024-10-01,0.0,1.0,1 month ago,Samsung S24,negative,week usage phone heating using camera finger print sensor upto mark pathetic performane even wifi lower version phone working much betteroverall good buy flagship phonei prefer buy,27
1.0,Hated it!,Worst phone and Worst camera,Ramanji Vempalli,True,2024-10-01,1.0,2.0,1 month ago,Samsung S24,negative,worst phone worst camera,4
1.0,Not recommended at all,charging port big prob newly buy waist money,Dinesh mhatre,True,2024-10-01,0.0,1.0,1 month ago,Samsung S24,negative,charging port big prob newly buy waist money,8
1.0,Worthless,"This phone is really great, but the charging cable is so bad. When I try to charge my phone, it's not working properly. Sometimes it starts to charge, but after some time, it disconnects automatically.🥲",Utpal  Das,True,2024-10-01,0.0,0.0,1 month ago,Samsung S24,negative,phone really great charging cable bad try charge phone working properly sometimes start charge time disconnect automatically,17
1.0,Very poor,Very bad camera,Shailendra Singh,True,2024-10-01,0.0,3.0,1 month ago,Samsung S24,negative,bad camera,2
1.0,Very poor,Too much heating issue worst battery maximum we can use 8to 9hrs,Flipkart Customer,True,2024-10-01,1.0,0.0,1 month ago,Samsung S24,negative,much heating issue worst battery maximum use hr,8
1.0,Terrible product,Phone getting restart,Hrithik Dahiya,True,2024-10-01,0.0,0.0,1 month ago,Samsung S24,negative,phone getting restart,3
1.0,Not recommended at all,"Heating issues, please don't buy this phone. Worst phone.",Govardhan Jaya,True,2024-10-01,7.0,11.0,1 month ago,Samsung S24,negative,heating issue please buy phone worst phone,7
1.0,Don't waste your money,Using mobile phone will be heat,Narender REDDY Veluri,True,2024-10-01,2.0,1.0,1 month ago,Samsung S24,negative,using mobile phone heat,4
1.0,Terrible product,Battery only last for 2 and half hours,Hmmmm Ok,True,2024-10-01,2.0,0.0,1 month ago,Samsung S24,negative,battery last half hour,4
1.0,Hated it!,Heating problem,SHER SINGH,True,2024-10-01,1.0,0.0,1 month ago,Samsung S24,negative,heating problem,2
1.0,Hated it!,"Camera is good but having lot kf heating issue and main is bettery, if i am traveling and using camera , I need to charge phone 3 times a day , bettery performance is pathatic, did not recommend",ABHISHEK SINGH SENGAR,True,2024-10-01,4.0,0.0,1 month ago,Samsung S24,negative,camera good lot heating issue main bettery traveling using camera need charge phone time day bettery performance pathatic recommend,19
1.0,Not recommended at all,Poor battery,Flipkart Customer,True,2024-10-01,0.0,1.0,1 month ago,Samsung S24,negative,poor battery,2
1.0,Worst experience ever!,I didn't get good phone,Flipkart Customer,True,2024-10-01,0.0,0.0,1 month ago,Samsung S24,negative,get good phone,3
1.0,Unsatisfactory,Bad camera,Abhinav Gothwal,True,2024-10-01,4.0,3.0,1 month ago,Samsung S24,negative,bad camera,2
1.0,Very poor,"Very low pixel clarity of taken photos,30x zoom is there but clarity is not there",gaddam g,True,2024-10-01,6.0,5.0,1 month ago,Samsung S24,negative,low pixel clarity taken photo zoom clarity,7
1.0,Absolute rubbish!,Not fully satisfied,Chetan Jain,True,2024-10-01,1.0,0.0,1 month ago,Samsung S24,negative,fully satisfied,2
1.0,Don't waste your money,"Donot buy from it flipkart , phone have wifi connectivity issue , overheating issue and their so called 10 day replacement policy , they will never replace your phone,i highly recommend donot go for discount I have s23 already which i buy from samsung store and it have better display than s24 from flipkart, worst experience",Flipkart Customer,True,2024-10-01,4.0,0.0,1 month ago,Samsung S24,negative,donot buy flipkart phone wifi connectivity issue overheating issue called day replacement policy never replace phone highly recommend donot discount already buy samsung store better display flipkart worst experience,29
1.0,Don't waste your money,Waste phone,Vishal Vishnu,True,2024-10-01,1.0,0.0,1 month ago,Samsung S24,negative,waste phone,2
1.0,Waste of money!,The battery is draining very quickly in 4 to 5 hours.,Flipkart Customer,True,2024-10-01,3.0,0.0,1 month ago,Samsung S24,negative,battery draining quickly hour,4
1.0,Don't waste your money,Backpanel is coming out in just 5,Dhruval Shah,True,2024-10-01,0.0,0.0,1 month ago,Samsung S24,negative,backpanel coming,2
1.0,Worst experience ever!,Mobile is getting heat very soon,Ishan Jaiswal,True,2024-10-01,2.0,0.0,1 month ago,Samsung S24,negative,mobile getting heat soon,4
1.0,Hated it!,Battery issue and camera not so good,Nilesh Ingle,True,2024-10-01,0.0,1.0,1 month ago,Samsung S24,negative,battery issue camera good,4
1.0,Not recommended at all,Poor,Shilpy Sharma,True,2024-10-01,0.0,1.0,1 month ago,Samsung S24,negative,poor,1
1.0,Utterly Disappointed,I disappointed only Battery performance,Jana Aa,True,2024-10-01,0.0,0.0,1 month ago,Samsung S24,negative,disappointed battery performance,3
1.0,Not recommended at all,The phone having over heating issue and battery performance is not good,Ayush Kumar,True,2024-10-01,2.0,0.0,1 month ago,Samsung S24,negative,phone heating issue battery performance good,6
1.0,Don't waste your money,"Camera is not good as hyped, takes blurry, shady, blacky photos. Battery discharges quickly. It's a wrong choice.",Gopalkrishna R Kadolkar,True,2024-10-01,6.0,3.0,1 month ago,Samsung S24,negative,camera good hyped take blurry shady blacky photo battery discharge quickly wrong choice,13
1.0,Don't waste your money,Small Chinks between camera lens and back panel,Shoaib Saifi,True,2024-10-01,1.0,0.0,1 month ago,Samsung S24,negative,small chink camera lens back panel,6
1.0,Utterly Disappointed,Waste of money don't buy,Flipkart Customer,True,2024-10-01,3.0,8.0,1 month ago,Samsung S24,negative,waste money buy,3
1.0,Utterly Disappointed,heating issues,Chandan Kumar,True,2024-10-01,4.0,0.0,1 month ago,Samsung S24,negative,heating issue,2
1.0,Unsatisfactory,Get defective piece and its litrally worst phone ever,kaushal  sharma,True,2024-10-01,1.0,0.0,1 month ago,Samsung S24,negative,get defective piece litrally worst phone ever,7
1.0,Not recommended at all,"Battery performance very low,If u r a working person then don't buy this phone,u hv 2 carry charger everywhere, it's disgusting 😑.",Sungida siddika Rahaman,True,2024-10-01,1.0,0.0,1 month ago,Samsung S24,negative,battery performance low working person buy phone carry charger everywhere disgusting,11
1.0,Very poor,Heating issues,RAja  Velampalli,True,2024-10-01,2.0,0.0,1 month ago,Samsung S24,negative,heating issue,2
1.0,Waste of money!,I have been overcharged for my phone.,Rahul Kaushik,True,2024-10-01,0.0,0.0,1 month ago,Samsung S24,negative,overcharged phone,2
1.0,Not recommended at all,Device heat very badly and battery draina very quickly. Just in 2 hours came drom from 60 to 10 %,Shiva  Regalla,True,2024-10-01,2.0,0.0,1 month ago,Samsung S24,negative,device heat badly battery draina quickly hour came drom,9
1.0,Waste of money!,"build quality is very bad, phone dropped from 3ft and it broke back glass. gorilla class victus 2 WHAT A JOKE!!!",punit kumar,True,2024-10-01,4.0,0.0,1 month ago,Samsung S24,negative,build quality bad phone dropped broke back glass gorilla class victus joke,12
1.0,Did not meet expectations,"Heats up so fast , sound quality is like cheap 10k inr phone like chinese brands",Arif  hussain,True,2024-10-01,0.0,0.0,1 month ago,Samsung S24,negative,heat fast sound quality like cheap inr phone like chinese brand,11
1.0,Waste of money!,Product having Overheat problem,Masood Alam,True,2024-10-01,2.0,0.0,1 month ago,Samsung S24,negative,product overheat problem,3
1.0,Terrible product,Dissapointed with size and camera quality...even heats with normal operations like taking photos ans surfing on phone...screen size also too small....,Kalpesh Panchal,True,2024-10-01,0.0,6.0,1 month ago,Samsung S24,negative,dissapointed size camera quality even heat normal operation like taking photo an surfing phone screen size also small,18
1.0,Very poor,It gets too hot and iphone 16 even 15 is better than this phoneAnd battery life is too bad,Sannat Chaudhry,True,2024-10-01,2.0,2.0,1 month ago,Samsung S24,negative,get hot iphone even better phoneand battery life bad,9
1.0,Very poor,Too much heating Poor battery,Rohit Vidhate,True,2024-10-01,1.0,0.0,1 month ago,Samsung S24,negative,much heating poor battery,4
1.0,Hated it!,"Prpduct i would say 4 ⭐️, little heating and battery issue. But the reaspn for one star is pathetic service from seller as well as flipkart aka scamcart",Darshil Thummar,True,2024-10-01,0.0,0.0,1 month ago,Samsung S24,negative,prpduct would say little heating battery issue reaspn one star pathetic service seller well flipkart aka scamcart,17
1.0,Hated it!,Fingerprint not working,Praveenkumar Patta,True,2024-10-01,1.0,1.0,1 month ago,Samsung S24,negative,fingerprint working,2
1.0,Don't waste your money,Very badVery hottt,Dr.jayvirsinh Jadeja,True,2024-10-01,0.0,0.0,1 month ago,Samsung S24,negative,badvery hottt,2
1.0,Waste of money!,Back color remove,Ritik Raina,True,2024-10-01,0.0,0.0,1 month ago,Samsung S24,negative,back color remove,3
1.0,Don't waste your money,Mobile already 13 days activated,Aditya  Vaishnav,True,2024-10-01,0.0,0.0,1 month ago,Samsung S24,negative,mobile already day activated,4
1.0,Don't waste your money,"The major issue is heating issue, whenever I take photo the phone turn into a heater, and when u use the phone phone morethan 1hr, again the become to heat, and battery backup is very poor.",Flipkart Customer,True,2024-10-01,0.0,0.0,1 month ago,Samsung S24,negative,major issue heating issue whenever take photo phone turn heater use phone phone morethan become heat battery backup poor,19
1.0,Absolute rubbish!,Camera quality very bad,Hh H,True,2024-10-01,0.0,0.0,1 month ago,Samsung S24,negative,camera quality bad,3
1.0,Worst experience ever!,Never buy from Flipkart.,N K,True,2024-10-01,0.0,0.0,1 month ago,Samsung S24,negative,never buy flipkart,3
1.0,Did not meet expectations,Phone is hitting very often,Flipkart Customer,True,2024-10-01,0.0,0.0,1 month ago,Samsung S24,negative,phone hitting often,3
1.0,Horrible,It is heating up when ever i use it,Jagrit Bhargava,True,2024-10-01,0.0,0.0,1 month ago,Samsung S24,negative,heating ever use,3
1.0,Waste of money!,Network issue,chandan kumar,True,2024-10-01,7.0,2.0,1 month ago,Samsung S24,negative,network issue,2
1.0,Not recommended at all,Facing network related issues..,Priyansh Limbasiya,True,2024-10-01,4.0,1.0,1 month ago,Samsung S24,negative,facing network related issue,4
1.0,Useless product,Heating issue and face id is not performing well,Bommakanti  Rakesh,True,2024-10-01,3.0,1.0,1 month ago,Samsung S24,negative,heating issue face performing well,5
1.0,Worthless,Overall performance is ok. But there's heating issue  that needs to be addressed.,Andrews Victor,True,2024-10-01,2.0,2.0,1 month ago,Samsung S24,negative,overall performance heating issue need addressed,6
1.0,Useless product,Worst experience,Vineet Anand,True,2024-10-01,2.0,0.0,1 month ago,Samsung S24,negative,worst experience,2
4.0,Delightful,Best deal in BBD Great experianceGo for it..! 4/5 *,Roopesh R Urit,True,2024-10-01,0.0,0.0,1 month ago,Samsung S24,positive,best deal bbd great experiancego,5
1.0,Terrible product,Over heating and default apps not installed,Udaygoud burra,True,2024-10-01,1.0,0.0,1 month ago,Samsung S24,negative,heating default apps installed,4
1.0,Terrible product,Worst product don't buy this.....Battery drain even your mobile is switched off,Divakar Shukla,True,2024-10-01,1.0,0.0,1 month ago,Samsung S24,negative,worst product buy battery drain even mobile switched,8
1.0,Worst experience ever!,Worst battery ever,Sunita Rajput,True,2024-10-01,0.0,0.0,1 month ago,Samsung S24,negative,worst battery ever,3
1.0,Did not meet expectations,"Battery Backup is Terrible , have to charge 2/3 times a day",MAYURI BHARALI,True,2024-10-01,2.0,0.0,1 month ago,Samsung S24,negative,battery backup terrible charge time day,6
1.0,Useless product,The product is good.. But the flipkart logestic department is worse,Suvam  Saha,True,2024-10-01,2.0,0.0,1 month ago,Samsung S24,negative,product good flipkart logestic department worse,6
1.0,Terrible product,When clicking Normal pictures it's heatingWhen using apps it's heating under normal conditions Very bad issue,Dawood Shaikh,True,2024-10-01,2.0,0.0,1 month ago,Samsung S24,negative,clicking normal picture heatingwhen using apps heating normal condition bad issue,11
1.0,Horrible,After take photo not bright,Sombir Tanwer,True,2024-10-01,0.0,0.0,1 month ago,Samsung S24,negative,take photo bright,3
5.0,Perfect product!,Super hit,Kiran Bala,True,2024-10-01,0.0,0.0,1 month ago,Samsung S24,positive,super hit,2
1.0,Worthless,"Don't buy this phone because of the hype , the seller is terrible and phone gets too hot when used for minimum stuff . Literally regrett",Ajay Shetty,True,2024-10-01,2.0,0.0,1 month ago,Samsung S24,negative,buy phone hype seller terrible phone get hot used minimum stuff literally regrett,13
1.0,Did not meet expectations,"Heating issue ,camera pixels not clear , battery drop down fast",Vinod kumar  Pal,True,2024-10-01,3.0,0.0,1 month ago,Samsung S24,negative,heating issue camera pixel clear battery drop fast,8
