rating,review_title,review_text,reviewer_name,verified_purchase,review_date,helpful_upvotes,helpful_total,review_date_raw,product,sentiment,clean_text,word_count
4.0,Pretty good,Good compact phone and having good camera but facing issu in battery because it's 4000 mah and it's not lasting for whole day. I have to carry power bank.I am sharing sample of photos.. it's light balance is very good.,Swayam Vish,True,2024-11-01,37.0,4.0,1 month ago,Samsung S24,positive,good compact phone good camera facing issu battery mah lasting whole day carry power bank sharing sample photo light balance good,21
4.0,Good quality product,"After using S24 for 4 days am writing this review overall a good compact and a handy phone if you want a beast camera, clean UI, battery backup is slightly less but it's okay for average use if you want a mobile for daily gaming than the battery backup will be lesser.If you want good handy Samsung phone than go for it🙌",Jayasuriya Anbu,True,2024-11-01,127.0,27.0,1 month ago,Samsung S24,positive,using day writing review overall good compact handy phone want beast camera clean battery backup slightly less okay average use want mobile daily gaming battery backup lesser want good handy samsung phone,32
5.0,Awesome,Today received this phone. It's just outstanding.  Battery is good. I m not facing any kind of Heating issue. Camera is far better than I phone. Just shared a photo of my friend in low light.,Arnab Deb,True,2024-11-01,10.0,0.0,1 month ago,Samsung S24,positive,today received phone outstanding battery good facing kind heating issue camera far better phone shared photo friend low light,19
5.0,Mind-blowing purchase,"Powerful performance, excellent display,compact size and amazing camera making it an allrounder phone. The only drawback is battery life.",Amit Kumar  Behera,True,2024-11-01,34.0,6.0,1 month ago,Samsung S24,positive,powerful performance excellent display compact size amazing camera making allrounder phone drawback battery life,14
5.0,Brilliant,Just looking like a wow,Raja,True,2024-11-01,64.0,15.0,1 month ago,Samsung S24,positive,looking like wow,3
5.0,Wonderful,"Excellent product and  worth it to buy , if there is an option to choose iphone15or16 and s24 then i would go with s24",Pawan Rajput,True,2024-11-01,9.0,0.0,1 month ago,Samsung S24,positive,excellent product worth buy option choose iphone would,8
5.0,Wonderful,Everything is just excellent but only battery is average,Abhishek Maurya,True,2024-11-01,8.0,0.0,1 month ago,Samsung S24,positive,everything excellent battery average,4
5.0,Best in the market!,I got the phone today the behaviour of delivery agent was awesome... for now i can only say good compact phone with awesome camera and processor a bit dissapointed with the battery and heating issue.... will share more info after some months of use,Mayank Shukla,True,2024-11-01,28.0,5.0,2 months ago,Samsung S24,positive,got phone today behaviour delivery agent awesome say good compact phone awesome camera processor bit dissapointed battery heating issue share info month use,23
5.0,Simply awesome,"Camera qulity and build qulity , sound qulity of this phon is oustanding. But normal hitting isshue experiance in this phone",Kiran Patil,True,2024-11-01,48.0,12.0,1 month ago,Samsung S24,positive,camera qulity build qulity sound qulity phon oustanding normal hitting isshue experiance phone,13
5.0,Worth every penny,Hi All. I am writing this review based on my 1 week usage. I bought it in the BBD Sale only. First of all I upgraded from S22 (Base) which i used for more than 1 year but the main problem was battery issue and heating. Did the upgrade was good I will tell you that it was great. I will also compare s24 with previous s22+ Pros* Camera is Great nothing particularly to tell about it. Because even i upgrade from S22 for last several years the camera software is same for samsung.* Processor I...,Niranjan G,True,2024-11-01,8.0,0.0,29 days ago,Samsung S24,positive,writing review based week usage bought bbd sale first upgraded base used year main problem battery issue heating upgrade good tell great also compare previous pro camera great nothing particularly tell even upgrade last several year camera software samsung processor,40
5.0,Wonderful,Totally satisfied product,Bablu Bablu,True,2024-11-01,8.0,0.0,1 month ago,Samsung S24,positive,totally satisfied product,3
5.0,Wonderful,Just wow🤩🤩,Flipkart Customer,True,2024-11-01,8.0,0.0,1 month ago,Samsung S24,positive,wow,1
4.0,Delightful,I feel the phone is getting hot very fastly apart from that camera and performance is good,Shamundeswari  S,True,2024-11-01,13.0,1.0,2 months ago,Samsung S24,positive,feel phone getting hot fastly apart camera performance good,9
5.0,Must buy!,Superb phoneCompact monster 💥 Little power house💥Nice camera😍Top display 🫰Battery back is average 👎😢,SANJU  SANTHOSH,True,2024-11-01,40.0,12.0,1 month ago,Samsung S24,positive,superb phonecompact monster little power house nice camera top display battery back average,13
5.0,Excellent,Battery averageCamera is not excellent  like flagship;and  other all thing is top notch,Radhe Radhe,True,2024-11-01,24.0,5.0,1 month ago,Samsung S24,positive,battery averagecamera excellent like flagship thing top notch,8
4.0,Very Good,"Like others, I was also initially concerned about its smaller battery capacity and slow charging speed before buying it. But one thing I would like to mention for whoever is planning to buy it now (snapdragon version), if you are not heavy gamer, then you can expect easily  backup of one day or even more. Otherwise the phone is good with other aspects like camera, software experience and day2day task performance etc.Charging speed is approx. 1 hour 20 minutes if you starts from 1-2% of ch...",Asutosh Acharya,True,2024-11-01,19.0,3.0,1 month ago,Samsung S24,positive,like others also initially concerned smaller battery capacity slow charging speed buying one thing would like mention whoever planning buy snapdragon version heavy gamer expect easily backup one day even otherwise phone good aspect like camera software experience day day task performance etc charging speed approx hour minute start,49
5.0,Fabulous!,"This phone is a beast! It's super fast, the screen is stunning, and the cameras are top-notch. The new Galaxy AI features are actually very practical. Fits perfectly in the hand and pocket. The battery life is solid for a full day of use. Go for it!",Ninaad Dhuri,True,2024-11-01,47.0,16.0,1 month ago,Samsung S24,positive,phone beast super fast screen stunning camera top notch new galaxy feature actually practical fit perfectly hand pocket battery life solid full day use,24
5.0,Highly recommended,"Best phone under 40k, better than expected, Best time to buy last year flagship phone this BBD. Battery can be concerned for heavy user otherwise it's fine for medium to lite user. Just go for it.",Lalit Parajiya,True,2024-11-01,67.0,26.0,1 month ago,Samsung S24,positive,best phone better expected best time buy last year flagship phone bbd battery concerned heavy user otherwise fine medium lite user,21
5.0,Awesome,"The interface is clean and fast. The Android 16 update is really snappy. The cameras are good, the telephoto camera could have been better, the quality feels like crop of the main camera. The battery life is surprisingly good, I had Xiaomi 11T pro with 5000mAh / 120W charging, I thought I'm downgrading with my choice, but it turns out to be other way around. With my moderate use I clock 2 days easily with this phone, the discharge rate is predictable unlike my previous phone. And, yes, t...",Srikant Patnaik,True,2024-11-01,5.0,0.0,1 month ago,Samsung S24,positive,interface clean fast android update really snappy camera good telephoto camera could better quality feel like crop main camera battery life surprisingly good xiaomi pro mah charging thought downgrading choice turn way around moderate use clock day easily phone discharge rate predictable unlike previous phone yes,46
5.0,Awesome,Perfect 👌,Flipkart Customer,True,2024-11-01,6.0,0.0,1 month ago,Samsung S24,positive,perfect,1
5.0,Terrific,"Many videos i have seen battery problem. Iam not a heavy user or gamer .from 4 days i didnt feel any heavy battery draining issue.I was using old mobile before so i am having habit of using power saving mode , which i continued here worked very amazing . No doubt best buy... camera amazing but low light little noise still best . And coming to ai features it's a beast . Mobile is very smaller than i expected which is very cute and good look. I didnt feel any heating issues and i kept my phone ...",Flipkart Customer,True,2024-11-01,15.0,3.0,1 month ago,Samsung S24,positive,many video seen battery problem iam heavy user gamer day didnt feel heavy battery draining issue using old mobile habit using power saving mode continued worked amazing doubt best buy camera amazing low light little noise still best coming feature beast mobile smaller expected cute good look didnt feel heating issue kept phone,53
5.0,Classy product,"This phone is very awesome all over performance, camera, look, build quality is very good, only samsung should provide more battery capacity with this phone...Overall all is great !",Flipkart Customer,True,2024-11-01,17.0,4.0,2 months ago,Samsung S24,positive,phone awesome performance camera look build quality good samsung provide battery capacity phone overall great,15
4.0,Delightful,One of the Best camera phone .,Gaurav Vyas,True,2024-11-01,6.0,0.0,1 month ago,Samsung S24,positive,one best camera phone,4
5.0,Highly recommended,Very nice phone,Ashish Mahto,True,2024-11-01,9.0,1.0,1 month ago,Samsung S24,positive,nice phone,2
5.0,Simply awesome,Here is the quick review of s24.Camera excellent. Battery backup not good. Display excellent Design excellent. Performance not good because of heating issue,Avirat  Zain,True,2024-11-01,10.0,2.0,1 month ago,Samsung S24,positive,quick review camera excellent battery backup good display excellent design excellent performance good heating issue,15
5.0,Terrific purchase,"i am upgrading after 7 years, and I liked it very much for its compact factor, colour, and design, easy to transfer data via smart switch",Rithik mohanta,True,2024-11-01,14.0,4.0,2 months ago,Samsung S24,positive,upgrading year liked much compact factor colour design easy transfer data via smart switch,14
5.0,Super!,Very nice product it's better than iphone 15 or 16,Rushikesh  Bhoj,True,2024-11-01,7.0,1.0,2 months ago,Samsung S24,positive,nice product better iphone,4
4.0,Value-for-money,"Premium, unexpected delightful smartphoneCamera and performance is good Battery is slightly not up to the mark.It lasts hardly for a day with moderate use￼",Flipkart Customer,True,2024-11-01,11.0,3.0,10 months ago,Samsung S24,positive,premium unexpected delightful smartphonecamera performance good battery slightly mark last hardly day moderate use,14
4.0,Worth the money,Product is good but i see it is getting heated a bit while using it for minimum time.,Arun Kumar,True,2024-11-01,9.0,2.0,2 months ago,Samsung S24,positive,product good see getting heated bit using minimum time,9
5.0,Awesome,Greet camera very smooth  display 👌 😎 👏,Birendar Thakur,True,2024-11-01,4.0,0.0,1 month ago,Samsung S24,positive,greet camera smooth display,4
5.0,Simply awesome,Oval all good 👍,JAHANGIR ALOM KHAN,True,2024-11-01,4.0,0.0,1 month ago,Samsung S24,positive,oval good,2
5.0,Must buy!,Good phone but  heating issue,Sudip Nath,True,2024-11-01,4.0,0.0,1 month ago,Samsung S24,positive,good phone heating issue,4
5.0,Simply awesome,Overall Good,AJAY METKAR,True,2024-11-01,4.0,0.0,1 month ago,Samsung S24,positive,overall good,2
5.0,Perfect product!,Love it,Rahul Gupta,True,2024-11-01,4.0,0.0,1 month ago,Samsung S24,positive,love,1
5.0,Just wow!,The phone offers exceptional performance.The camera's capabilities are impressive.The user interface is highly intuitive.It is exceptionally user-friendly.,Shivakumar D,True,2024-11-01,3.0,0.0,1 month ago,Samsung S24,positive,phone offer exceptional performance camera capability impressive user interface highly intuitive exceptionally user friendly,14
5.0,Excellent,All is best if u get it i should  cary the power bank also charge twice in day,Prajwal Choudhary,True,2024-11-01,4.0,0.0,1 month ago,Samsung S24,positive,best get cary power bank also charge twice day,9
5.0,Brilliant,"Since thousands of reviews have been written on this phone, it seems unnecessary for me to delve deeper into the details. It's a wonderful compact phone with great design, wonderful display and unmatched UI. Only area it is lacking in is battery and camera hardware. Samsung has to work seriously on these two aspects. Primary camera and selfie camera are excellent but the ultra wide and especially the ten MP telephoto lenses fall short of delivering the expected results more so in low light. R...",Prashantha S,True,2024-11-01,10.0,3.0,1 month ago,Samsung S24,positive,since thousand review written phone seems unnecessary delve deeper detail wonderful compact phone great design wonderful display unmatched area lacking battery camera hardware samsung work seriously two aspect primary camera selfie camera excellent ultra wide especially ten telephoto lens fall short delivering expected result low light,46
5.0,Terrific purchase,Look wise best. Battery wise average. It discharges faster.  Storage and technologies are best. Overall lovely phone.,Kapil Mewada,True,2024-11-01,8.0,2.0,2 months ago,Samsung S24,positive,look wise best battery wise average discharge faster storage technology best overall lovely phone,14
4.0,Pretty good,Verry good phone at this price ..value for money..if the screen size little bit bigger then it will more effective 😄. Other wize smooth well degin camery quality and camera both are awesome..happy to byu,Rishab Chowdhury,True,2024-11-01,10.0,3.0,1 month ago,Samsung S24,positive,verry good phone price value money screen size little bit bigger effective wize smooth well degin camery quality camera awesome happy byu,22
5.0,Great product,"The form factor, the size, the weight, its awsome. It always feels like a precious piece of jewelry ✨️. Especially in this particular color the bezels feels lot thinner.The software is extremely optimized. One UI is a bliss. The hardware with Snapdragon 8 Gen 3 literally delivers lightning fast performance. The battery performs all day and ends up with around 20%. The camera is good, but not the best. And the price i bought the 256 variant was a steal deal.",Krishnajith P S,True,2024-11-01,11.0,4.0,1 month ago,Samsung S24,positive,form factor size weight awsome always feel like precious piece jewelry especially particular color bezel feel lot thinner software extremely optimized one bliss hardware snapdragon gen literally delivers lightning fast performance battery performs day end around camera good best price bought variant steal deal,44
5.0,Awesome,Camera amazing good looking,Santanu Kumar,True,2024-11-01,7.0,2.0,1 month ago,Samsung S24,positive,camera amazing good looking,4
5.0,Great product,Osm Camera and Performance good So Nice S24 Snapdragon 8 Gen 3..,Rahul Chaudhary,True,2024-11-01,2.0,0.0,16 days ago,Samsung S24,positive,osm camera performance good nice snapdragon gen,7
5.0,Terrific purchase,Best phone go for it.,Vivek Jain,True,2024-11-01,3.0,0.0,1 month ago,Samsung S24,positive,best phone,2
5.0,Highly recommended,Overall phone justify it's price very wellBest camera. Best design.. best design.. best processor..  I mean everything a super android smartphone..Bt if we talk about battery then it's little disappointing... U can't use whole day a battery life,Ashish Pandey,True,2024-11-01,2.0,0.0,1 month ago,Samsung S24,positive,overall phone justify price wellbest camera best design best design best processor mean everything super android smartphone talk battery little disappointing use whole day battery life,26
5.0,Highly recommended,Very n,Ravi  Kumar,True,2024-11-01,3.0,0.0,1 month ago,Samsung S24,positive,,0
5.0,Mind-blowing purchase,"Overall good performance,  look , display!/// just they need to think about battery give upto 5 to 6 hr screen on time but if you use normly without gamming it can support a Day!",Rushi  Tiwari,True,2024-11-01,3.0,0.0,1 month ago,Samsung S24,positive,overall good performance look display need think battery give upto screen time use normly without gamming support day,18
5.0,Must buy!,Excellent phone but battery life could have been better,Ramkanna Raja,True,2024-11-01,3.0,0.0,1 month ago,Samsung S24,positive,excellent phone battery life could better,6
5.0,Best in the market!,Excellent product battery upto 8hrs without gaming,saranraj rajamoorthy,True,2024-11-01,3.0,0.0,1 month ago,Samsung S24,positive,excellent product battery upto hr without gaming,7
5.0,Highly recommended,"Camera quality is really good, and this quality you won't be able to find in any other smartphone which is upto 30k smartphones. Performance is also very good. Display quality is awesome. Battery and charging capacity is slightly less and if you are ok with it you can definitely go fir it blindly.",Kishlay Raj,True,2024-11-01,3.0,0.0,1 month ago,Samsung S24,positive,camera quality really good quality able find smartphone upto smartphones performance also good display quality awesome battery charging capacity slightly less definitely fir blindly,24
5.0,Simply awesome,Nice product with best build up. Camera and all features are awsome except battery.,Amitkumar  Pandey,True,2024-11-01,3.0,0.0,1 month ago,Samsung S24,positive,nice product best build camera feature awsome except battery,9
5.0,Highly recommended,LIGHT WEIGHT...SMOOTH DISPLAY...GOOD CAMERA,Hari karan,True,2024-11-01,3.0,0.0,9 months ago,Samsung S24,positive,light weight smooth display good camera,6
5.0,Perfect product!,Overall very Good but battery not enough 2 time charging require in a day,Flipkart Customer,True,2024-11-01,8.0,3.0,1 month ago,Samsung S24,positive,overall good battery enough time charging require day,8
4.0,Worth the money,Phone is Good. Battery is the minus point.,Gopal Customer,True,2024-11-01,3.0,0.0,1 month ago,Samsung S24,positive,phone good battery minus point,5
4.0,Value-for-money,Everything is top notch except battery,Rokom Mibang,True,2024-11-01,3.0,0.0,1 month ago,Samsung S24,positive,everything top notch except battery,5
4.0,Very Good,"Good camera, decent battery life. Good Performance.Overall, a decent phone if you get it at around 40k",ANDUKURI SARATH CHANDRASEKHAR,True,2024-11-01,5.0,1.0,2 months ago,Samsung S24,positive,good camera decent battery life good performance overall decent phone get around,12
5.0,Terrific,Good compact phone and surprisingly good battery backup too.Nice camera set,raghavendra balemane,True,2024-11-01,9.0,4.0,2 months ago,Samsung S24,positive,good compact phone surprisingly good battery backup nice camera set,10
5.0,Excellent,Better than iphone.,Anand Kumar  Pandey,True,2024-11-01,6.0,2.0,1 month ago,Samsung S24,positive,better iphone,2
5.0,Just wow!,"I held this phone for the first time, and I was really appreciative of this product because it's an amazing phone in this segment.Camera: 5/5Display: 5/5Performance: 5/5Design: 5/5Value for money: 5/5",Dhrumin  Nizama,True,2024-11-01,6.0,2.0,1 month ago,Samsung S24,positive,held phone first time really appreciative product amazing phone segment camera display performance design value money,16
3.0,Decent product,Phone form factor and camera are excellent. Major drawbacks are the heating issue when using camera and the faster battery drain. These may be attributed to the Samsung's Exynos processor's inferior performance. Potential buyers of this phone can buy the S23 instead or wait for the Galaxy S25 which will sport the latest Snapdragon processor which will solve both the drawbacks. S25 is rumoured to be launched in Jan 2025.,Raju VENKATA KRISHNAM,True,2024-11-01,10.0,2.0,"Nov, 2024",Samsung S24,neutral,phone form factor camera excellent major drawback heating issue using camera faster battery drain may attributed samsung exynos processor inferior performance potential buyer phone buy instead wait galaxy sport latest snapdragon processor solve drawback rumoured launched jan,37
5.0,Awesome,"If you bought this phone, this BBD sale.. its a great buy,  with a price point of 37k. UI is super smooth and you get Android 15 and oneUI 8 in a day or two post purchase along with security updates.1. The phone does heat up, if you use it for extended period of time, sometimes when you charge.2. The battery is 3840 mah, not 4k like advertised and if you are a heavy user, charging twice a day may be needed or a extra powerback needs to be carried.3. Camera is outstanding 4. Speakers are ...",Ankan Debgupta,True,2024-11-01,4.0,1.0,1 month ago,Samsung S24,positive,bought phone bbd sale great buy price point super smooth get android oneui day two post purchase along security update phone heat use extended period time sometimes charge battery mah like advertised heavy user charging twice day may needed extra powerback need carried camera outstanding speaker,46
5.0,Just wow!,Awesome,MANIDIPA DAS,True,2024-11-01,4.0,1.0,2 months ago,Samsung S24,positive,awesome,1
5.0,Just wow!,much better than iphone15/16,Shantanu Lahoti,True,2024-11-01,4.0,1.0,2 months ago,Samsung S24,positive,much better iphone,3
5.0,Excellent,"Overall very good smartphone. Not for heavy users or professional photographers. Very crisp display. Very fast. Battery drains fast, light to medium users can use it full day with 1 time charge.",Deepak Bhushan,True,2024-11-01,2.0,0.0,4 days ago,Samsung S24,positive,overall good smartphone heavy user professional photographer crisp display fast battery drain fast light medium user use full day time charge,21
5.0,Worth every penny,Everything is good but the battery backup is so poor,Sanju Surendran,True,2024-11-01,2.0,0.0,11 days ago,Samsung S24,positive,everything good battery backup poor,5
5.0,Brilliant,"Writing a review after 1 month of usage.This phone has made me write it otherwise I don't usually do it.One word for this phone - 'Amazing'.Everything is 5/5 I saw too many comments about battery it lasts me for a day with 6 hr of SOT and this has not changed.  And if you put this on other performance mode profile it will last for 7.5hr SOT. Taking about camera its just amazing, clearly my friends using iPhones was suddenly using this phone to take pictures the 3x is the most loved th...",Amit  Admame,True,2024-11-01,2.0,0.0,24 days ago,Samsung S24,positive,writing review month usage phone made write otherwise usually one word phone amazing everything saw many comment battery last day sot changed put performance mode profile last sot taking camera amazing clearly friend using iphones suddenly using phone take picture loved,41
5.0,Excellent,Good Purchase 1. Nice Camera Quality 2. Due to compact Design its comfortable in hand3. Premium Feel in Hand alomg with Premium minimalistic Design4. Voice Quality Nice,Rasesh Daru,True,2024-11-01,2.0,0.0,30 days ago,Samsung S24,positive,good purchase nice camera quality due compact design comfortable hand premium feel hand alomg premium minimalistic design voice quality nice,20
5.0,Just wow!,Top class flagship mobile display camera parformance,shankar Daddimani,True,2024-11-01,2.0,0.0,1 month ago,Samsung S24,positive,top class flagship mobile display camera parformance,7
5.0,Wonderful,This good phone for camera  and all  of. I listened  somewhere  on social  media  that  battery  is not good perform  but  i  charged  full  battery  i used  full  day  with  any  complaint  so  you can buy this  phone,Stranger For u,True,2024-11-01,2.0,0.0,1 month ago,Samsung S24,positive,good phone camera listened somewhere social medium battery good perform charged full battery used full day complaint buy phone,19
5.0,Excellent,S24  is amazing phone at just 40K. Surprisingly battery life is also very good with SD 8Gen3.,ONGC A/C S G AWAR CPF 127937 CPF 127937,True,2024-11-01,2.0,0.0,1 month ago,Samsung S24,positive,amazing phone surprisingly battery life also good gen,8
5.0,Just wow!,"Samsung s series mobiles lot of improvements in recent years, good compact mobile but flipkart delivery system in Nellore was pathetic",Mahammad Abdul  Zaleel SK,True,2024-11-01,2.0,0.0,1 month ago,Samsung S24,positive,samsung series mobile lot improvement recent year good compact mobile flipkart delivery system nellore pathetic,15
5.0,Terrific,Look like a premium device,Deva raj,True,2024-11-01,2.0,0.0,1 month ago,Samsung S24,positive,look like premium device,4
5.0,Brilliant,"Amazing smartphone, awesome camera",Subhanjan,True,2024-11-01,2.0,0.0,1 month ago,Samsung S24,positive,amazing smartphone awesome camera,4
5.0,Wonderful,"Battery performance could have been better. For heavy users, an evening top-up is required. For normal usage, it lasts the whole day.",Amit kumar singh,True,2024-11-01,2.0,0.0,1 month ago,Samsung S24,positive,battery performance could better heavy user evening top required normal usage last whole day,14
