rating,review_title,review_text,reviewer_name,verified_purchase,review_date,helpful_upvotes,helpful_total,review_date_raw,product,sentiment,clean_text,word_count
5.0,Super! Camera,"The Samsung Galaxy S24 delivers a strong all-round camera performance, particularly in daylight. Its 50 MP main sensor captures sharp, detailed, and vibrant images with natural colors, while the ultrawide and selfie cameras perform well for landscapes and portraits, offering consistent color and exposure across lenses.",BIKASH  CHETIA,True,2024-11-01,1.0,1.0,1 month ago,Samsung S24,positive,samsung galaxy delivers strong round camera performance particularly daylight main sensor capture sharp detailed vibrant image natural color ultrawide selfie camera perform well landscape portrait offering consistent color exposure across lens,31
5.0,Perfect product!,Words can't describe this phone. If you are looking for an allrounder and you can sacrifice for battery. Then go for it,Flipkart Customer,True,2024-11-01,1.0,1.0,1 month ago,Samsung S24,positive,word describe phone looking allrounder sacrifice battery,7
5.0,Worth every penny,Camera 📸 10/10Performance 🎮 10/10Battery 🔋 8/10This phone only have 4000 mh battery but give good backup this phone capture better photo in night as compare to iphone 13 14 15 16 in half price this is an killer flagship level phone with 8 gen 3 snapdragon which give 120 fps in game buy this phone without any question,RUDRA RAPATWAR,True,2024-11-01,1.0,1.0,1 month ago,Samsung S24,positive,camera performance battery phone battery give good backup phone capture better photo night compare iphone half price killer flagship level phone gen snapdragon give fps game buy phone without question,30
5.0,Awesome,"The Samsung Galaxy S24 is a well-regarded compact smartphone, praised for its vibrant and bright 120Hz display, powerful flagship performance, and excellent build quality. Its integrated Galaxy AI features, such as real-time translation and photo editing tools, are considered highlights. However, battery life can be a concern for heavy users, and the charging speeds are slower than some competitors. The cameras deliver good, social-media-ready photos, though some might prefer more detail from...",Ketan Ladda,True,2024-11-01,1.0,1.0,1 month ago,Samsung S24,positive,samsung galaxy well regarded compact smartphone praised vibrant bright display powerful flagship performance excellent build quality integrated galaxy feature real time translation photo editing tool considered highlight however battery life concern heavy user charging speed slower competitor camera deliver good social medium ready photo though might prefer detail,48
5.0,Brilliant,The compact beast 🔥🔥In hand feel is so goodBattery backup is better. i am using on 60HrzCamera is good  but phone is warm quickly,Saurabh Dhavale,True,2024-11-01,1.0,1.0,1 month ago,Samsung S24,positive,compact beast hand feel goodbattery backup better using hrzcamera good phone warm quickly,13
5.0,Terrific purchase,"Everything is top notch, but I want some little more backup.",Rishi Sinoriya,True,2024-11-01,1.0,1.0,1 month ago,Samsung S24,positive,everything top notch want little backup,6
5.0,Simply awesome,"10/10 phone fully satisfied, I love it.",Aditya Tekam,True,2024-11-01,1.0,1.0,1 month ago,Samsung S24,positive,phone fully satisfied love,4
5.0,Super!,"Very good product,value for money",Flipkart Customer,True,2024-11-01,0.0,1.0,1 month ago,Samsung S24,positive,good product value money,4
5.0,Just wow!,GOOD,JATIN  Rajput,True,2024-11-01,1.0,0.0,2 months ago,Samsung S24,positive,good,1
5.0,Terrific,Very good experience,Sekh Raju,True,2024-11-01,1.0,1.0,2 months ago,Samsung S24,positive,good experience,2
5.0,Best in the market!,"Great Phone,, Awesome Camera, Awesome Display,  Awesome Speed, Worth it.",Manpreet  Singh,True,2024-11-01,1.0,1.0,10 months ago,Samsung S24,positive,great phone awesome camera awesome display awesome speed worth,9
4.0,Good quality product,the phone is amezing camera is very good display is amazing and the performance is also amazing but the bettry is decent i mean if u are a havy user with minimum of 10 hour of screen on time then u sholud leave it because u have charge it once or twise in a day.,Vivan  Jewriya,True,2024-11-01,1.0,1.0,1 month ago,Samsung S24,positive,phone amezing camera good display amazing performance also amazing bettry decent mean havy user minimum hour screen time sholud leave charge twise day,23
4.0,Delightful,Ita really,Amit Roy,True,2024-11-01,1.0,1.0,1 month ago,Samsung S24,positive,ita really,2
3.0,Good,One star less for Exynos processor. Review after 6 months of use.Avoid phones with Exynos. Big lag in processing in every process. Irritating. Give feeling of buffering in earlier days on internet.,Abhijit Nagre,True,2024-11-01,3.0,2.0,4 months ago,Samsung S24,neutral,one star less exynos processor review month use avoid phone exynos big lag processing every process irritating give feeling buffering earlier day internet,23
5.0,Perfect product!,Good and comfortable,venkatasubabrao somisetty,True,2024-11-01,1.0,2.0,1 month ago,Samsung S24,positive,good comfortable,2
5.0,Terrific,"The Samsung Galaxy S24 is a compact yet powerful flagship that perfectly balances performance, design, and practicality. Its Exynos 2400 chip delivers smooth multitasking and gaming, while the Dynamic AMOLED 2X 120Hz display offers stunning visuals. The camera system excels in detail and low light, and battery life comfortably lasts a full day, though 25W charging feels a bit slow.With One UI 6.1 + Galaxy AI, the software experience feels smart and intuitive, and 7 years of updates ensure l...",Swarit Krishna Sah,True,2024-11-01,1.0,2.0,1 month ago,Samsung S24,positive,samsung galaxy compact yet powerful flagship perfectly balance performance design practicality exynos chip delivers smooth multitasking gaming dynamic amoled display offer stunning visuals camera system excels detail low light battery life comfortably last full day though charging feel bit slow one galaxy software experience feel smart intuitive year update ensure,50
5.0,Terrific,"The phone's design is sleek and modern, offering a comfortable feel in hand. Its performance is incredibly smooth, thanks to the powerful processor and ample RAM. The display is vibrant and bright, making content consumption a pleasure. The camera system captures stunning photos and videos in various lighting conditions. Overall, this phone offers a premium experience with its impressive features and capabilities.Thanks Flipkar as well...",Hasmukh  Raval,True,2024-11-01,1.0,2.0,1 month ago,Samsung S24,positive,phone design sleek modern offering comfortable feel hand performance incredibly smooth thanks powerful processor ample ram display vibrant bright making content consumption pleasure camera system capture stunning photo video various lighting condition overall phone offer premium experience impressive feature capability thanks flipkar well,43
5.0,Great product,Guys overall phone is good but if you are heavy user you need to charge it twice a day 1 camera is too good i really like2 performance of phone is also very smooth3 yess there is heating issues sometime in basic task but not in extreme mild heat only4 display is very good even in sunlight 5 over all a good package desing is premium You guys can go with it if you are not a gamer,Akshit Chauhan,True,2024-11-01,1.0,2.0,1 month ago,Samsung S24,positive,guy overall phone good heavy user need charge twice day camera good really like performance phone also smooth yes heating issue sometime basic task extreme mild heat display good even sunlight good package desing premium guy gamer,37
3.0,Good,After one month of proper use i figured out Camera is not too good as much as youtubers shows in their video with snapdragon 8gen3 performance and battery performance also improved but facing heating issues overall nothing big issues detected if you want to go for a bloatware free android experience must go for samsung and also in 39k price it is a good deal 🤝,Ram ratan Palsania,True,2024-11-01,2.0,1.0,24 days ago,Samsung S24,neutral,one month proper use figured camera good much youtubers show video snapdragon gen performance battery performance also improved facing heating issue overall nothing big issue detected want bloatware free android experience must samsung also price good deal,37
3.0,Nice,"It's heating up like crazy, in just 5 minutes of setting up the phone it was already pretty hot. The battery is also draining super fast. It does not feel like old samsung phone as the UI and the look feels like an imitation of iphone. The Camera is not as great as mentioned by various reviewers either.For this price it's not worth it.Think twice before buying.",Flipkart Customer,True,2024-11-01,2.0,1.0,1 month ago,Samsung S24,neutral,heating like crazy minute setting phone already pretty hot battery also draining super fast feel like old samsung phone look feel like imitation iphone camera great mentioned various reviewer either price worth think twice buying,35
1.0,Unsatisfactory,"NEVER EVER BUY FROM FLIPKART.In this day and age, when we have a genuine reason as to why we should return a product, the same is rejected stating it is not in the policy. I have tried 3-4 times and the customer service is pathetic. No matter what happens please buy your mobiles only from AZ or the direct online store. FLIPKART is very unresponsive as a middleman and it is like talking to a wall.In other countries, people return the phone after using and get the preferred one, even after ...",Shanthini BS,True,2024-10-01,211.0,23.0,"Oct, 2024",Samsung S24,negative,never ever buy flipkart day age genuine reason return product rejected stating policy tried time customer service pathetic matter happens please buy mobile direct online store flipkart unresponsive middleman like talking wall country people return phone using get preferred one even,41
3.0,Nice,Battery problem facing,Trilok  Singh,True,2024-11-01,1.0,0.0,4 days ago,Samsung S24,neutral,battery problem facing,3
3.0,Good,Small Battery,Flipkart Customer,True,2024-11-01,1.0,0.0,17 days ago,Samsung S24,neutral,small battery,2
3.0,Fair,Phone heating,GOPICHAND MALOTH,True,2024-11-01,1.0,0.0,30 days ago,Samsung S24,neutral,phone heating,2
3.0,Just okay,Heating On 5g network,Falguni Padhan,True,2024-11-01,1.0,0.0,1 month ago,Samsung S24,neutral,heating network,2
3.0,Good,Whatapps video call heating problem,Jawahar Singh,True,2024-11-01,0.0,0.0,1 month ago,Samsung S24,neutral,whatapps video call heating problem,5
3.0,Good,All is good but battery performance very low,Sangram Keshari Mohanty,True,2024-11-01,0.0,0.0,1 month ago,Samsung S24,neutral,good battery performance low,4
3.0,Terrific purchase,Worth it,Gopalakrishnan R,True,2024-11-01,0.0,0.0,1 month ago,Samsung S24,neutral,worth,1
3.0,Fair,I am iphone user this is not for me type too much heat and lag,Alok  Nigam,True,2024-11-01,1.0,0.0,1 month ago,Samsung S24,neutral,iphone user type much heat lag,6
3.0,Just okay,Very good phone under 40k flagship level proformance and camera but decent battery life,Ankush Sahani,True,2024-11-01,1.0,0.0,1 month ago,Samsung S24,neutral,good phone flagship level proformance camera decent battery life,9
3.0,Decent product,It's s grate smart phone in this budget,Bijoy Barman,True,2024-11-01,1.0,0.0,1 month ago,Samsung S24,neutral,grate smart phone budget,4
3.0,Good,It have heating issue When you open camera for 5 to 10 minutes. It's camera also not that good enough. In this price range other phones gives much better performance and camera clearity and features.,Deepak Jangid,True,2024-11-01,1.0,0.0,1 month ago,Samsung S24,neutral,heating issue open camera minute camera also good enough price range phone give much better performance camera clearity feature,19
3.0,Decent product,Battary poor,Subhash  Kumar,True,2024-11-01,1.0,0.0,1 month ago,Samsung S24,neutral,battary poor,2
3.0,Does the job,I used this phone for 1 week i found smoe lags and phone is heating a lot,Flipkart Customer,True,2024-11-01,1.0,0.0,1 month ago,Samsung S24,neutral,used phone week found smoe lag phone heating lot,9
3.0,Fair,A good phone. Only drawback is battery capacity .,Swapnil Bhosle,True,2024-11-01,1.0,0.0,1 month ago,Samsung S24,neutral,good phone drawback battery capacity,5
3.0,Decent product,Heating issue is genuine. Rest everything is average.,Saurabh  Kumar Singh,True,2024-11-01,1.0,0.0,1 month ago,Samsung S24,neutral,heating issue genuine rest everything average,6
3.0,Nice,"To the point while using this flagship for day It's heating a lot and battery is draining fast though its design and performance is quiet good at this price seg Since it is heating like hell in a normal use  , my excitement turn into disappointment U should go for another phone If u are OK with heating probo.. then u can buy it It's definitely handy phone feels premium but edges are not smooth",Flipkart Customer,True,2024-11-01,0.0,0.0,1 month ago,Samsung S24,neutral,point using flagship day heating lot battery draining fast though design performance quiet good price seg since heating like hell normal use excitement turn disappointment another phone heating probo buy definitely handy phone feel premium edge smooth,37
3.0,Does the job,"Mobile is awesome,  but battery is very bad",Chandrashekhar Reddy,True,2024-11-01,0.0,0.0,1 month ago,Samsung S24,neutral,mobile awesome battery bad,4
3.0,Fair,It is great premium compact phone under 40k. But facing heating issue since day 1. Some say that the software takes time to analyse the usage pattern and save battery and not to get heated. Need to see. But this level of heating issue is not expected from a premium smartphone,Flipkart Customer,True,2024-11-01,1.0,0.0,1 month ago,Samsung S24,neutral,great premium compact phone facing heating issue since day say software take time analyse usage pattern save battery get heated need see level heating issue expected premium smartphone,28
3.0,Decent product,Battery problem bas,Flipkart Customer,True,2024-11-01,1.0,0.0,2 months ago,Samsung S24,neutral,battery problem ba,3
5.0,Brilliant,"Upgraded to 16 from 13, feels like coming to a new world 😂😂",Devang Gupta,True,2024-11-01,1.0,3.0,2 months ago,Samsung S24,positive,upgraded feel like coming new world,6
3.0,Does the job,camera quality is not good,Vishv Vikas Patidar,True,2024-11-01,3.0,3.0,1 month ago,Samsung S24,neutral,camera quality good,3
3.0,Decent product,It has wrost battery performance and literally I am warning these who are going to purchase a mobile which is almost 60k  it has terrible heat problem if you have AC go for it if not don't ever purchase it as in normal use it heats like a burnt coal,Rudraksh Dubey,True,2024-11-01,3.0,2.0,1 month ago,Samsung S24,neutral,wrost battery performance literally warning going purchase mobile almost terrible heat problem ever purchase normal use heat like burnt coal,20
5.0,Classy product,Awesome mobile good price,Kiran,True,2024-11-01,0.0,0.0,Today,Samsung S24,positive,awesome mobile good price,4
5.0,Wonderful,Absolutely good,Sanju Gamit,True,2024-11-01,0.0,0.0,Today,Samsung S24,positive,absolutely good,2
4.0,Good choice,Phone heats a lot using camera..,Nil Deka,True,2024-11-01,0.0,0.0,1 day ago,Samsung S24,positive,phone heat lot using camera,5
5.0,Must buy!,The product is very good performance and battery backup is good mobile in hand feelings smoothness very better than other mobile camera quality also good video quality superb 👌 👍,Bhaskar Talukdar,True,2024-11-01,0.0,0.0,1 day ago,Samsung S24,positive,product good performance battery backup good mobile hand feeling smoothness better mobile camera quality also good video quality superb,19
5.0,Worth every penny,Gd,Vicky Sher,True,2024-11-01,0.0,0.0,1 day ago,Samsung S24,positive,,0
5.0,Best in the market!,Best phone,Nitish Kumar  Suman,True,2024-11-01,0.0,0.0,1 day ago,Samsung S24,positive,best phone,2
5.0,Highly recommended,Excellent 👍🏻 flagship flagship only... Samsung never disappoints with flagship phone 📱,SHAIK GOUSE BASHA,True,2024-11-01,0.0,0.0,2 days ago,Samsung S24,positive,excellent flagship flagship samsung never disappoints flagship phone,8
5.0,Brilliant,"There is no need for further elaboration. The provided images effectively showcase the excellent camera capabilities of this phone. However, in practical daily use, the device experiences battery backup issues due to its relatively low battery capacity of only 4000mAh.",jitendra kumar pradhan,True,2024-11-01,0.0,0.0,2 days ago,Samsung S24,positive,need elaboration provided image effectively showcase excellent camera capability phone however practical daily use device experience battery backup issue due relatively low battery capacity mah,25
5.0,Classy product,According to price Awesome 👌,VINAY KUMAR,True,2024-11-01,0.0,0.0,3 days ago,Samsung S24,positive,according price awesome,3
4.0,Worth the money,Mobile is very good 👍,Bhupender Kumar,True,2024-11-01,0.0,0.0,3 days ago,Samsung S24,positive,mobile good,2
5.0,Terrific purchase,"I just love my S24, Dilshad's S24 suits on me",Dilshad  Khan,True,2024-11-01,0.0,0.0,3 days ago,Samsung S24,positive,love dilshad suit,3
5.0,Must buy!,Awesome picture quality and good build Quality n des,CHETAN KACHARE,True,2024-11-01,0.0,0.0,3 days ago,Samsung S24,positive,awesome picture quality good build quality de,7
5.0,Must buy!,Good phone,Shek Sahabuddin,True,2024-11-01,0.0,0.0,4 days ago,Samsung S24,positive,good phone,2
4.0,Really Nice,Ok,Flipkart Customer,True,2024-11-01,0.0,0.0,4 days ago,Samsung S24,positive,,0
5.0,Worth every penny,It's a classy phone!!,Abhay  Pradhan,True,2024-11-01,0.0,0.0,4 days ago,Samsung S24,positive,classy phone,2
5.0,Mind-blowing purchase,Camera quality and performance is top notch 👌  and I've been using it for 2 months.  The only problem is battery otherwise is the best phone,MAKHIAN,True,2024-11-01,0.0,0.0,4 days ago,Samsung S24,positive,camera quality performance top notch using month problem battery otherwise best phone,12
2.0,Bad quality,Bettry backup is very poor.Phone setting functions should have been simple.,Rajnish Kumar,True,2024-11-01,1.0,0.0,4 days ago,Samsung S24,negative,bettry backup poor phone setting function simple,7
4.0,Worth the money,Great 👍,MOON  BARUAH,True,2024-11-01,0.0,0.0,5 days ago,Samsung S24,positive,great,1
5.0,Best in the market!,Very good 👍👍👍👍,Noor Maan,True,2024-11-01,0.0,0.0,5 days ago,Samsung S24,positive,good,1
5.0,Fabulous!,Best phone in overall parformnace,Lalit Kumar,True,2024-11-01,0.0,0.0,5 days ago,Samsung S24,positive,best phone overall parformnace,4
5.0,Terrific,Very nice mobile,Ajay Ajay,True,2024-11-01,0.0,0.0,5 days ago,Samsung S24,positive,nice mobile,2
5.0,Just wow!,Power house,Chitul  Das,True,2024-11-01,0.0,0.0,6 days ago,Samsung S24,positive,power house,2
5.0,Excellent,Amazing  q,Raj Yuvraj sinh,True,2024-11-01,0.0,0.0,6 days ago,Samsung S24,positive,amazing,1
5.0,Excellent,Awesome 👌,MOHSIN  ANSARI,True,2024-11-01,0.0,0.0,6 days ago,Samsung S24,positive,awesome,1
2.0,Expected a better product,Not good daly u,Pradip Chandra roy Customer,True,2024-11-01,1.0,1.0,6 days ago,Samsung S24,negative,good daly,2
2.0,Not good,Apple is more more better than this stupid,SRav Tanwar,True,2024-11-01,1.0,7.0,7 days ago,Samsung S24,negative,apple better stupid,3
5.0,Just wow!,Best flagship phone for this price .,Flipkart Customer,True,2024-11-01,0.0,0.0,7 days ago,Samsung S24,positive,best flagship phone price,4
5.0,Awesome,"Must buy, one of the performance phone in below 40k",Flipkart Customer,True,2024-11-01,0.0,0.0,7 days ago,Samsung S24,positive,must buy one performance phone,5
5.0,Excellent,Great Purchase Just one downside is that Battery Backup A bit lower Will get 5.30 to 6 hours Screen On Time.Tips:- Reduce Refresh Rate to 60Hzs and Off Always on Display To Get Maximum Battery is Battery is Your Priority.Peace Out👍,Kundan Kumar,True,2024-11-01,0.0,0.0,7 days ago,Samsung S24,positive,great purchase one downside battery backup bit lower get hour screen time tip reduce refresh rate hz always display get maximum battery battery priority peace,25
4.0,Nice product,Nice Design,Beam NG,True,2024-11-01,0.0,0.0,7 days ago,Samsung S24,positive,nice design,2
5.0,Worth every penny,Very good,Kapil Rawani,True,2024-11-01,0.0,0.0,7 days ago,Samsung S24,positive,good,1
2.0,Waste of money!,Speaker problem in 1 week,Satyajit Daimari,True,2024-11-01,1.0,0.0,7 days ago,Samsung S24,negative,speaker problem week,3
5.0,Perfect product!,I m happy to this phone,Vinay Jaiswal,True,2024-11-01,0.0,0.0,7 days ago,Samsung S24,positive,happy phone,2
3.0,Samsung S24 5G vs iPhoe 16 review.,"Used Samsung Galaxy S24 5G extensively for over 20 days. In compariosn of iPhone 16, the S24 stand nowhere near to iPhone 16 in terms UI, security, Camera etc.The landing screen of both the phone is highly different and iPhone stands class apart. In terms of frequent notification, iPhone display it in a very nice way without actually opening the phone which is completely lacking in S24. The onlu feature of S24 is use of dual camera while recording is something not available in iPhone. Further...",Hari Shankar Sharma AC SAIL ISP,True,2024-11-01,0.0,4.0,7 days ago,Samsung S24,neutral,used samsung galaxy extensively day compariosn iphone stand nowhere near iphone term security camera etc landing screen phone highly different iphone stand class apart term frequent notification iphone display nice way without actually opening phone completely lacking onlu feature use dual camera recording something available iphone,46
5.0,Awesome,"Overall it's fine, camera, sound quality,performance is good.....charging is too slow. Takes almost 2 mins for charging 1% with 35W charger, but notification says fast charging. Disappointed with battery performance too.",Bishal  Das,True,2024-11-01,0.0,0.0,7 days ago,Samsung S24,positive,overall fine camera sound quality performance good charging slow take almost min charging charger notification say fast charging disappointed battery performance,21
5.0,Perfect product!,Grt,himanshu kumar,True,2024-11-01,0.0,0.0,7 days ago,Samsung S24,positive,grt,1
3.0,Just okay,Varry nice,Somenath Dey,True,2024-11-01,0.0,0.0,7 days ago,Samsung S24,neutral,varry nice,2
5.0,Classy product,Best,Alvi Sarkar,True,2024-11-01,0.0,0.0,8 days ago,Samsung S24,positive,best,1
5.0,Just wow!,Always Feel special with sansun,Flipkart Customer,True,2024-11-01,0.0,0.0,8 days ago,Samsung S24,positive,always feel special sansun,4
5.0,Perfect product!,Fabulous 👌,TUSHAR BHANDARI,True,2024-11-01,0.0,0.0,8 days ago,Samsung S24,positive,fabulous,1
5.0,Simply awesome,Best in class,Jafru Deen,True,2024-11-01,0.0,0.0,8 days ago,Samsung S24,positive,best class,2
3.0,Decent product,Best Mobile for Photography 📸,Flipkart Customer,True,2024-11-01,0.0,0.0,8 days ago,Samsung S24,neutral,best mobile photography,3
3.0,Does the job,Heating issues and videography is poor 🤡,Mayur Rathod,True,2024-11-01,0.0,0.0,8 days ago,Samsung S24,neutral,heating issue videography poor,4
5.0,Classy product,Superb,Flipkart Customer,True,2024-11-01,0.0,0.0,8 days ago,Samsung S24,positive,superb,1
5.0,Great product,"Its a wonderfull mobile best mobile in 35k to 40k budget. Camera - best camera, you can compare it to S24ultraDisplay - Best in the classBattery - my screen time 4hrs to 5hrs, I have to charge it twice a dayPerformance - very smooth and no lagUI - Best experianceI will recommend this mobile",Ankit Khanna,True,2024-11-01,0.0,0.0,9 days ago,Samsung S24,positive,wonderfull mobile best mobile budget camera best camera compare ultradisplay best classbattery screen time hr hr charge twice dayperformance smooth lagui best experiancei recommend mobile,25
5.0,Worth every penny,Grate camera but battery 💔,Manu M,True,2024-11-01,0.0,0.0,9 days ago,Samsung S24,positive,grate camera battery,3
4.0,Pretty good,Nice phone Battery not good,Mohd Islamuddin,True,2024-11-01,0.0,0.0,9 days ago,Samsung S24,positive,nice phone battery good,4
1.0,Hated it!,Worst phone for pubg please don't buy.,Mangbiang Kharmawlong,True,2024-11-01,1.0,4.0,9 days ago,Samsung S24,negative,worst phone pubg please buy,5
5.0,Super!,Very nice product on this price,MASUM Sk,True,2024-11-01,0.0,0.0,9 days ago,Samsung S24,positive,nice product price,3
5.0,Excellent,"I expect better camera , some realme users compare my s24 with there phone and told me , there camera is better than s24 , and I see the clear difference.  But It is okay, may be after some update it may become better. But Overall it is performance phone. Go for it",Agrim Varshney,True,2024-11-01,0.0,0.0,9 days ago,Samsung S24,positive,expect better camera realme user compare phone told camera better see clear difference okay may update may become better overall performance phone,22
5.0,Excellent,Top mobile Sound top,Flipkart Customer,True,2024-11-01,0.0,0.0,9 days ago,Samsung S24,positive,top mobile sound top,4
5.0,Perfect product!,S24 is One of the best phone. I loved it 😍 No lagging and regular updates. Your life makes easier !!!!,Niranjan Kumbhar,True,2024-11-01,0.0,0.0,9 days ago,Samsung S24,positive,one best phone loved lagging regular update life make easier,10
5.0,Best in the market!,NICE,AMAN  RAJ,True,2024-11-01,0.0,0.0,10 days ago,Samsung S24,positive,nice,1
5.0,Mind-blowing purchase,Excellent 👍🏻,Debanga Mallick,True,2024-11-01,0.0,0.0,10 days ago,Samsung S24,positive,excellent,1
5.0,Just wow!,The best at this price,Poornima Naik,True,2024-11-01,0.0,0.0,10 days ago,Samsung S24,positive,best price,2
5.0,Must buy!,Using this Iphone 15 from 1month and it has best Camera,Flipkart Customer,True,2024-04-01,106.0,16.0,"Apr, 2024",iPhone 15,positive,using iphone month best camera,5
5.0,Wonderful,Amezing  camera and all over best phone👌,Neeraj  Chouhan,True,2024-11-01,222.0,41.0,"Nov, 2024",iPhone 15,positive,amezing camera best phone,4
